url,headline,date,body,headline_word_count,body_word_count
https://www.abc.net.au/news/2018-07-23/medical-cannabis-patients-in-australia-look-to-united-states/10026308,"Medical cannabis in Australia 'pretty much inaccessible', leaving patients looking to US",Mon 23 Jul 2018 at 9:23am," Medical cannabis in Australia 'pretty much inaccessible', leaving patients looking to US The Liberal Party has announced its formal opposition to the federal government's model for an Indigenous Voice to Parliament Peter Dutton is speaking on the Liberal Party's opposition to the government's model for an Indigenous Voice to Parliament There is an emergency fire warning in place for parts of Oakford, south of Perth, in the shire of Serpentine-Jarrahdale. For the latest information, search ABC Emergency Keep up with the latest ASX and business news A father who escaped jail time for juicing cannabis to treat his two daughters is now considering sending one of them overseas for treatment. Stephen Taylor's daughters, Morgan, 21, and Ariel, 25, suffer from Crohn's disease, a debilitating bowel disease. ""We've been thinking about me going to America for a while,"" Morgan told 7.30. ""We may have to do that,"" Mr Taylor said. ""Such a shame we can't do [cannabis juicing] in our own country."" Mr Taylor began to grow and juice his own cannabis after struggling to find a doctor who would help him through the Therapeutic Goods Administration's (TGA) lengthy application process to legally access medical marijuana. Last week, after pleading guilty to cultivation, Mr Taylor was given a six-month good behaviour bond but no conviction was recorded. Morgan Taylor has been in and out of hospital several times this year with her condition. She now has access to medicinal cannabis oil under the Federal Government's scheme because of her chronic pain, but not because of her Crohn's disease. Her sister Ariel missed out. If the oil does not work for Morgan she is considering going to the US. Bastian Seidel, president of the Royal College of GPs, is frustrated that so few patients are being given the option to access medicinal cannabis and so few doctors are being allowed to prescribe it. ""There are 38,000 GPs in the country — only one of them is an authorised prescriber for medicinal cannabis,"" he told 7.30. He said medical marijuana was still ""pretty much inaccessible"" for those who need it. ""The hurdles are still in place,"" Dr Seidel said. ""It is frustrating for us because medicinal cannabis might be an option of last resort for patients where we've tried absolutely everything in the book. ""Certainly this is not what patients expect. That's not what should be in place when it comes to medicinal cannabis. ""If your GP thinks you would benefit from medicinal cannabis as a treatment of last resort, then your GP should be allowed to prescribe it."" In a statement to 7.30, the TGA said 249 individual medical practitioners have had applications approved under its Special Access Scheme. It added that ""33 medical practitioners have been approved as authorised prescribers"". Iain McGregor, a psychopharmacologist at the Lambert Initiative For Cannabinoid Therapeutics at Sydney University, estimates as many as 100,000 people in the country may be using illegal cannabis for medical problems. ""They're self-medicating with cannabis that they get from friends or grow themselves,"" he told 7.30. ""There's this massive discrepancy between what Australians are doing covertly and the overt approved system which, so far, I would say, is probably not delivering."" Professor McGregor said juicing cannabis ""gives a very different cannabinoid profile than smoking cannabis"". ""In many ways, juicing is a positive thing to do because you don't get nearly as much of the intoxicating element, which is THC [tetrahyrdocannabinol], and you get another component of cannabinoid, which is THCA [tetrahydocannabinolic acid], which has very strong anti-inflammatory properties in the gut,"" he said. ""Proper clinical trials on THCA have not been done and this is one of the generic problems that we have with medicinal cannabis. ""This prohibition that we have over the years is really stymieing progress in terms of learning the therapeutic effects of the plant."" The TGA said 1059 people across the nation had been approved for the TGA scheme in the two years since the access was legalised in Australia. We acknowledge Aboriginal and Torres Strait Islander peoples as the First Australians and Traditional Custodians of the lands where we live, learn, and work. This service may include material from Agence France-Presse (AFP), APTN, Reuters, AAP, CNN and the BBC World Service which is copyright and cannot be reproduced. AEST = Australian Eastern Standard Time which is 10 hours ahead of GMT (Greenwich Mean Time)",12,728
https://www.abc.net.au/news/2017-08-23/cannabis-email-has-government-accused-of-defying-senate/8835622,Medicinal cannabis: Government accused of defying will of Senate over importation,Wed 23 Aug 2017 at 12:35pm," Medicinal cannabis: Government accused of defying will of Senate over importation The Liberal Party has announced its formal opposition to the federal government's model for an Indigenous Voice to Parliament Peter Dutton is speaking on the Liberal Party's opposition to the government's model for an Indigenous Voice to Parliament There is an emergency fire warning in place for parts of Oakford, south of Perth, in the shire of Serpentine-Jarrahdale. For the latest information, search ABC Emergency Keep up with the latest ASX and business news An attempt to open up access to imported medicinal cannabis for dying patients has failed, prompting accusations the executive arm of the Government is defying the will of the Parliament. In June a rainbow coalition of senators came together to defeat the Government and overturn restrictions on the importation of cannabis-based medicines for terminally ill patients. But in an email obtained by Lateline, the Government subsequently warned importers they would be in breach of their permit and licence conditions if they followed the will of the Senate. The email, sent by the Office of Drug Control in the Department of Health, notes the Senate vote ""allows access to medicinal cannabis products under the Special Access Scheme Category A"". But the email goes on to warn importers ""it is a breach of your permit and licence conditions if you supply any imported medicinal cannabis product to a patient under SAS-A"". Special Access Scheme for Category A enables medicines that are not on the register to be supplied to patients who are seriously ill and likely to die within months. Greens Leader Richard Di Natale said it was reprehensive behaviour by the Government. ""They've threatened importers that they will have their licence removed if they follow the law and make this drug available to people with a terminal illness,"" he told Lateline. Senator David Leyonhjelm said the Government was being ""cruel"".  ""Effectively, what that letter is saying is 'We don't care what the Senate decided. We're telling you, you will not sell your cannabis products to Category A patients or make those products available to them'."" The Greens disallowance motion passed the Senate 40-30 on June 13 with the support of Labor, One Nation and Senators Leyonhjelm, Jacqui Lambie, Derryn Hinch and Lucy Gichuhi. The Government imposed the original restrictions in October last year with the support of the Greens and Labor, fearing untested and unregulated medicines would put Australian patients at risk. Its cautious approach to importation has also been backed by the Australian Medical Association and the Royal College of GPs. A spokesman for Health Minister Greg Hunt said the email was not in defiance of the Senate, claiming the Greens and Labor were warned their motion would fail but they chose to mislead patients. Labor's health spokeswoman Catherine King told Lateline: ""The Government should be doing everything it can to expand patient access to medicinal cannabis, not hiding behind technicalities."" Senator Di Natale said the Greens would try again when Parliament returned. ""I'll be introducing legislation to the Parliament to ensure that anybody who needs access to medicinal cannabis who has a terminal illness can get it either through somebody importing it into Australia or indeed through a registered grower here in Australia."" We acknowledge Aboriginal and Torres Strait Islander peoples as the First Australians and Traditional Custodians of the lands where we live, learn, and work. This service may include material from Agence France-Presse (AFP), APTN, Reuters, AAP, CNN and the BBC World Service which is copyright and cannot be reproduced. AEST = Australian Eastern Standard Time which is 10 hours ahead of GMT (Greenwich Mean Time)",11,604
"https://www.abc.net.au/news/2017-07-07/medicinal-cannabis-driving-plan-crazy,-sa-police-minister-says/8686688","Medicinal cannabis driving plan inconsistent with road safety objectives, SA Police Minister says",Thu 6 Jul 2017 at 11:01pm," Medicinal cannabis driving plan inconsistent with road safety objectives, SA Police Minister says The Liberal Party has announced its formal opposition to the federal government's model for an Indigenous Voice to Parliament Peter Dutton is speaking on the Liberal Party's opposition to the government's model for an Indigenous Voice to Parliament There is an emergency fire warning in place for parts of Oakford, south of Perth, in the shire of Serpentine-Jarrahdale. For the latest information, search ABC Emergency Keep up with the latest ASX and business news Plans to allow medicinal cannabis users to drive in South Australia have been labelled ""crazy"" by the Police Minister. The state's Upper House voted in favour of the amendment put forward by Dignity Party's Kelly Vincent to Labor's Drink and Drug Driving Bill yesterday. Ms Vincent said the proposal would only apply if a doctor said the motorist's driving would not be impaired by the prescribed medical treatment. Last year, the Federal Government legalised the prescription of medicinal cannabis and earlier this year South Australia slashed red tape allowing doctors to prescribe the treatment. ""It's no longer illicit to use medical cannabis, it is legal and we need to move this conversation forward so that we understand that a positive test does not always equal impairment,"" Ms Vincent said. ""We need to show trust in the medical profession that we trust their judgment when it comes to assessing  people as to whether they are fit to drive or not."" Greens MLC Mark Parnell said the amendment was not a ""get-out-of-jail-free card"" but it would give people the ability to go to court and explain their circumstances. Police Minister Peter Malinauskas attacked the ""good intentioned"" amendment and said it was ""inconsistent"" with road safety objectives and labelled it ""crazy"". ""It is getting to the point where more people are dying on our roads because of drug consumption than there are of drink drinking,"" he said. ""So this needs a response, hence the Government has opened up the act and [are] making a number of changes."" It's been a long time coming but we're finally investigating (scientifically) the medicinal properties of marijuana. Currently, drug testing only detects the presence of tetrahydrocannabinol (THC) in a person's system and not the amount like alcohol testing. He said the Government supported the medical treatment but needed to keep road users safe. ""Our objective here is to make sure that people who get behind a wheel of a car have their brain operating in such a way that doesn't cause a risk to everyone else on the road,"" Mr Malinauskas said. ""What we know from a range of research from around the world [is] that ... any consumption of cannabis that results in THC being in your system impairs your ability to drive and therefore you shouldn't be getting behind the wheel of a car and putting every other road user at risk."" Mr Malinaukas said not all medicinal cannabis had THC but many did. He also said some people might decide to take greater doses of the drug than the prescribed amount. The bill still needs to be considered by the Lower House.  We acknowledge Aboriginal and Torres Strait Islander peoples as the First Australians and Traditional Custodians of the lands where we live, learn, and work. This service may include material from Agence France-Presse (AFP), APTN, Reuters, AAP, CNN and the BBC World Service which is copyright and cannot be reproduced. AEST = Australian Eastern Standard Time which is 10 hours ahead of GMT (Greenwich Mean Time)",13,590
https://www.abc.net.au/news/2020-05-08/wodonga-veteran-chronic-pain-relief-medicinal-cannabis/12216404,Former soldier Eli Turner prescribed medicinal cannabis after waiting months in 'unbearable' chronic pain,Thu 7 May 2020 at 8:43pm," Former soldier Eli Turner prescribed medicinal cannabis after waiting months in 'unbearable' chronic pain Former US president Donald Trump has appeared in a New York courtroom to face criminal charges. Follow live Catch up with The Loop, your quick wrap of this morning's news Keep up with the latest ASX and business news Doctors have labelled medicinal cannabis prescriptions a ""bureaucratic nightmare"" requiring ""a massive learning curve"", as patients say people in pain cannot wait months for relief. Wodonga's Eli Turner, suffers from a spinal condition called spondylosis after his time in the military and said he was ""very lucky"" to have a prescription for medicinal cannabis after waiting six months in unbearable pain. ""It doesn't eliminate the pain totally — nothing will,"" he said. ""But it definitely makes me able to move more and function more."" But the 39-year-old said receiving the prescription was very difficult. ""People are in a lot of pain and they can't wait because you can't function in that much pain,"" Mr Turner said. The former soldier asked his doctor about medicinal cannabis after he found out about a Department of Veterans' Affairs subsidy program. ""It costs so much for pain treatment of any type … there's no way I could have afforded it on my own,"" he said. No medicinal cannabis product is subsidised through the Pharmaceutical Benefits Scheme [PBS], making it too expensive for many patients. But Mr Turner has been determined to avoid opioids to treat his pain after seeing his mother's experience with morphine before her death from lung disease. ""She was on a lot of morphine and it was just inhumane,"" he said. ""It was horrible. It was absolutely horrible. ""She was less than 40kg when she passed away."" Mr Turner has also seen the addictive effect of opioids on some of his mates from the army who have endured chronic pain. ""I was posted to a parachuting unit, so [back pain] comes with the area,"" he said. ""And a lot of them are having trouble getting off opioids … they probably never will."" His local doctor referred him to Mark Hardy, a Sydney-based addiction medicine specialist and the medical director at Cannabis Access Clinics. Dr Hardy helps doctors and patients around the country navigate the cannabis prescription process. ""One of the pitfalls for a lot of our GPs who we get referrals from is that they're very time pressured,"" he said. ""The writing to the Therapeutic Goods Administration (TGA) is time-consuming. ""Watching over the [cannabis] use, and potential for misuse, for a GP with little training in the area may be another impost on their time."" Doctors wishing to prescribe medicinal cannabis must apply to the TGA to seek individual patient approval — an approach Dr Hardy believed was lagging behind the latest research. ""We're seeing new evidence coming out in the medicinal cannabis space every month and if you're looking at guidelines from three years ago then you're looking at out-of-date guidelines,"" he said. ""This, for us, is one of our biggest challenges. ""Most of the opinion that is formed in regards to the legitimacy of our treatment is outdated by the time it's published and put to peer review."" Albury-Wodonga radiation oncologist, Craig Macleod, has looked into prescribing medicinal cannabis but said the process was too much of a ""bureaucratic nightmare"". The Federal Government has approved the sale of medicinal marijuana, but it still won't be easy for people to get a prescription. ""We investigated it through the hospital pharmacy but it's a heavily bureaucratic process so it's quite hard to get to order it in a simple fashion,"" he said. ""I think that there would be people interested in prescribing it … but, unless you've got a volume of patients that you're doing it for, it's too hard to do it for one or two patients."" Palliative care physician at Albury Wodonga Health, Chi Li, has prescribed medicinal cannabis for cancer patients but said there was ""a massive learning curve"". ""That's a disincentive for people to learn how to do it,"" he said. But he said that it was a relatively straightforward process after the initial barrier. A Senate committee has recommended widespread changes after a recent investigation into the problems around access to prescription cannabis and regulation.  Following this inquiry the TGA has proposed loosening restrictions for low-dose cannabidiol (CBD), a medicinal cannabis product. But many medical bodies believe there is still not enough evidence to support medicinal cannabis. Australia's peak medical body, the Australian Medical Association (AMA), said medicinal cannabis was a ""last resort"". ""The AMA position is that while there is widespread interest in medicinal cannabis, there is still insufficient information on efficacy, product availability, and education regarding its use,"" an AMA spokesperson said. Dr Hardy was optimistic this would change soon. ""I'm hopeful that in the coming years we'll be able to update the evidence based upon which people make their decisions,"" he said. We acknowledge Aboriginal and Torres Strait Islander peoples as the First Australians and Traditional Custodians of the lands where we live, learn, and work. This service may include material from Agence France-Presse (AFP), APTN, Reuters, AAP, CNN and the BBC World Service which is copyright and cannot be reproduced. AEST = Australian Eastern Standard Time which is 10 hours ahead of GMT (Greenwich Mean Time)",14,887
https://www.abc.net.au/news/2017-07-31/medifarm-medicinal-marijuana-farm-qld-sunshine-coast/8759502,Medicinal cannabis farm allows rare glimpse into construction at secret Queensland location,Mon 31 Jul 2017 at 2:59am," Medicinal cannabis farm allows rare glimpse into construction at secret Queensland location The Liberal Party has announced its formal opposition to the federal government's model for an Indigenous Voice to Parliament Peter Dutton is speaking on the Liberal Party's opposition to the government's model for an Indigenous Voice to Parliament There is an emergency fire warning in place for parts of Oakford, south of Perth, in the shire of Serpentine-Jarrahdale. For the latest information, search ABC Emergency Keep up with the latest ASX and business news A medicinal cannabis farm under construction in Queensland has opened its doors for the first time to offer an exclusive glimpse of its top-secret operation. Medifarm, based on the state's Sunshine Coast, has a rare licence granted by the Federal Government to cultivate, produce and manufacture medicinal cannabis. When the farm is up and running, it will produce cannabis oil for Australians with medical conditions. Strict security arrangements are in place to make sure the location of the farm is not compromised. Founder Adam Benjamin said security was paramount when growing such a controversial crop. ""We offered our security solutions which really focused on no diversions — which means if there was a potential threat out there, or even product that moves from the farm into distribution, it needs to at all times be tracked and accounted for,"" he said. ""So senior police, senior military personnel were brought in to advise, and we think we got it right."" It is the first time an Australian medicinal cannabis farm has allowed the media to visit. Non-disclosure forms had to be signed before reporters were taken in a convoy to the site. The Federal Government has approved the sale of medicinal marijuana, but it still won't be easy for people to get a prescription. Farm staff also undergo stringent checks before they are allowed to work there. ""All staff and all future staff go through a checklist, including Australian Federal Police background checks,"" Mr Benjamin said. While exact security arrangements cannot be discussed, the site is guarded 24/7. But Mr Benjamin conceded there was always the potential someone could stumble across its location. ""We are doing this on Earth, so there is the potential,"" he said. ""If someone was to find out, we believe our security measures and our counter measures will be right — it's very James Bond … but we came to market through the law and we're going to continue through the law."" The farm is currently under construction with greenhouses still being built. But it is hoped the first crop will be planted later this year. From there, the company is aiming to harvest four times a year, which could help thousands of people. ""Here we believe that what we are growing could service 5,000 patients,"" Mr Benjamin said. ""Potentially in Queensland, you're looking at 100,000 patients who could gain benefit from this as a medicine. ""We will have product cultivated and ready for distribution in the first quarter next year."" We acknowledge Aboriginal and Torres Strait Islander peoples as the First Australians and Traditional Custodians of the lands where we live, learn, and work. This service may include material from Agence France-Presse (AFP), APTN, Reuters, AAP, CNN and the BBC World Service which is copyright and cannot be reproduced. AEST = Australian Eastern Standard Time which is 10 hours ahead of GMT (Greenwich Mean Time)",12,564
