url,headline,date,body,headline_word_count,body_word_count
https://www.abc.net.au/news/health/2019-02-20/medical-marijuana-whats-the-evidence-for-treating-illness/10823036,Medicinal cannabis: Does it work and what's the evidence for different conditions?,Wed 20 Feb 2019 at 12:10am,"Health Medicinal cannabis: Does it work and what's the evidence for different conditions? The Liberal Party has announced its formal opposition to the federal government's model for an Indigenous Voice to Parliament Peter Dutton is speaking on the Liberal Party's opposition to the government's model for an Indigenous Voice to Parliament Keep up with the latest ASX and business news Thousands of Australians are now using medicinal cannabis to treat conditions like chronic pain and anorexia. Yesterday, the ABC revealed more than 3,100 medicinal cannabis scripts had been approved by the Therapeutic Goods Administration (TGA) since the Federal Government relaxed restrictions in March 2018. According to experts, these people were just the tip of the iceberg. It has been estimated as many as 100,000 Australians self-medicate with cannabis they've acquired illegally. Advocates of the drug say it offers a safe and effective solution to people with intractable medical conditions. But critics, and some of Australia's leading medical experts, argue there's limited quality evidence to support the use of medicinal cannabis in most conditions. So, what do we know about it? And why, in some cases, is it still so little? Research into the safety and efficacy of cannabis has traditionally been very difficult. This is partly because of the illegal nature of cannabis, and partly because of the complexity of the cannabis plant itself. Christian Read insists while medical medicinal cannabis can't cure him of the pain he experiences, it grants him some relief. Cannabis contains more than 400 bioactive molecules, about 100 of which are cannabinoids — a diverse group of natural chemicals that bind to the body's endocannabinoid receptors to produce various effects. The two main cannabinoids that have been found to have therapeutic benefits are delta-9-tetrahydrocannabinol (THC) and cannabidiol (CBD). THC is known for its psychoactive effects — it's what makes a person 'high', and is why people use marijuana recreationally. CBD, on the other hand, is not psychoactive, and is thought to moderate the 'high' caused by THC. The ratios of THC and CBD (and other cannabinoids) determine choice of product for treatment of disease. Different cannabis strains contain different ratios of THC to CBD, and it unclear whether they act individually or in conjunction with each other. Because of the inherent variability of the cannabis plant, as well as the many ways it can be administered, the types of products, doses and research methods used in clinical studies have varied significantly. This, according to the TGA, has made it difficult to ""come to firm conclusions"" about how best to use medicinal cannabis. It's also why, with the exception of one product (used for muscle spasticity in multiple sclerosis), medicinal cannabis products are not available as registered prescription medicines. Despite suggestions medicinal cannabis may help with everything from chronic pain to reducing anxiety, scientific literature to date has painted a mixed, and largely inconclusive picture. Amid growing public interest in the drug in recent years, the National Drug and Alcohol Research Centre (NDARC) conducted a systematic review of medicinal cannabis in 2017, which formed the basis of current TGA guidelines. On the whole, the review found the evidence was ""limited"", and suggested cannabis only be used when registered medicines have been ""tried and proven unsuccessful"". Jennifer Martin, director of the Australian Centre for Cannabinoid Clinical and Research Excellence, said it was better for patients to use drugs that had been registered by the TGA first. ""That's because current therapies that we've got have been assessed for safety, quality, and consistency,"" Professor Martin said. The TGA review found the strongest evidence for medicinal cannabis was in children and young adults with drug-resistant epilepsy, for which CBD products have been shown to reduce the frequency of seizures by 50 per cent or more in up to half of paediatric patients. ""This is probably where our best evidence is to date,"" Professor Martin said. The review found there was ""low to moderate"" evidence for medicinal cannabis products helping with the pain symptoms of multiple sclerosis, although the evidence was inconsistent. For chemotherapy-induced nausea and vomiting, the review found high-THC medicinal cannabis products were ""as effective"" as conventional drugs — but the review only compared marijuana with older, superseded drugs. ""A lot the studies were from the 1990s, before we had really good drugs for chemotherapy-induced nausea and vomiting,"" Professor Martin said. ""Now we have really good drugs, there's not really a need for cannabis products in this space."" For chronic pain, there was some evidence medicinal cannabis could assist with neuropathic (nerve) pain — but for most patients the effect was modest. However, a large-scale 2017 review from the National Academy of Sciences, Engineering, and Medicine in the US found ""substantial evidence that cannabis is an effective treatment for chronic pain in adults"". ""But when the Australian team updated the information, they found we would have to treat 24 patients with this particular cannabinoid for one of them to get a reduction in their pain symptoms,"" Professor Martin said. ""Certainly some people that have taken cannabinoids do say they have had a lot of benefit, but we have also seen older patients who have had side effects."" Professor Martin said although medicinal cannabis was likely to be less harmful than opioid medication, the solution to chronic pain wasn't as simple as moving someone off one pain medication and on to another. ""It's an important question that needs further research … but I think my colleagues in the pain medicine and addiction medicine community would tell you it's not that straightforward,"" she said. When it comes to palliative care, the NDARC review found there was little evidence that medicinal cannabis benefited advanced cancer patients with chronic pain. However, Michael Farrell, who is director of NDARC and helped author the 2017 review, said the main concerns about medicinal cannabis were centred around long-term usage — which are ""not an issue"" when it comes to end of life. ""I can't see why we should worry too much about complex evidence if it's for short-term management,"" Professor Farrell said. Iain McGregor from the Lambert Initiative For Cannabinoid Therapeutics at Sydney University said although much more research into medicinal cannabis was needed, it was important not to conflate ""poor evidence"" with an ""absence of evidence"". ""In many cases the TGA guidelines state that good quality evidence has not been done in a particular area,"" Professor McGregor said. ""That's a very different outcome to good quality studies have been done and cannabis was ineffective. ""Often it’s just the case that the studies haven’t yet been done."" Professor McGregor said he thought Australia was ""erring too far on the side of caution"" in its approach to medicinal cannabis. ""I think other similar OECD countries have decided to give cannabis the benefit of the doubt, particularly in patients who are desperate,"" he said. But Professor Martin said Australia was right to take a slow and steady approach to developing knowledge about the efficacy and safety of medicinal cannabis. ""Patients have a short-term solution — they can get access through the TGA system,"" she said. ""But long term, we still have to collect rigorous data and make sure our patients are safe before we roll out open access to a product that we don't really know how to use properly."" Professor Farrell agreed and said it was ""important people have realistic expectations of what medicinal cannabis might do, other than thinking it's some sort of magic bullet"". Get the latest health news and information from across the ABC. We acknowledge Aboriginal and Torres Strait Islander peoples as the First Australians and Traditional Custodians of the lands where we live, learn, and work. This service may include material from Agence France-Presse (AFP), APTN, Reuters, AAP, CNN and the BBC World Service which is copyright and cannot be reproduced. AEST = Australian Eastern Standard Time which is 10 hours ahead of GMT (Greenwich Mean Time)",12,1315
https://www.abc.net.au/news/2020-07-02/medicinal-cannabis-use-in-australia-black-market/12387408,"Medicinal cannabis is legal in Australia, but people like Grace are still turning to the black market",Wed 1 Jul 2020 at 9:30pm," Medicinal cannabis is legal in Australia, but people like Grace are still turning to the black market The Liberal Party has announced its formal opposition to the federal government's model for an Indigenous Voice to Parliament Peter Dutton is speaking on the Liberal Party's opposition to the government's model for an Indigenous Voice to Parliament Keep up with the latest ASX and business news After Grace* was diagnosed with cancer earlier this year, she turned to medicinal cannabis. But accessing it through legal medical channels was a challenge: she faced long waiting times and substantial paperwork. ""I was offered through an illegal source where I could get it very quickly, and because my tumours were aggressive and time is of the essence, I decided to opt for the non-medical option,"" she tells ABC RN's Life Matters. Grace started to get cannabidiol (CBD) oil sent to her in the post, in an olive oil bottle. But concerns about the illegalities of the drug started to weigh on her conscience, and she worried about the chemical composition of the CBD oil she was taking. ""If you're obtaining it through a medical source and it's been approved, there's stringent procedures and processes in order to create that oil. Whereas if I'm getting it off an illegal source, it's hard to actually know exactly what I'm taking,"" she says. Does medicinal cannabis work? Take a look at the evidence for different conditions. She decided to ""have another look at obtaining it through the medical channels"" — but in the end, she opted to ""stick with the illegal source"". ""It just seemed like the most easiest, cost effective option for me,"" Grace says. Nicholas Lintzeris, an addiction medicine specialist at the University of Sydney, says Grace's experience is not uncommon. ""The legal system we've had available now has been in place for about four years, and in the early days for the first couple of years we had a very clunky system,"" he says. Professor Lintzeris was the lead researcher in a study on how Australians use medicinal cannabis — for everything from chronic pain to mental health conditions. The online survey of more than 1,300 people found that while cannabis is used widely for medicinal reasons, the vast majority of respondents don't get it from their doctor.  ""It was very difficult for patients to be able to find doctors who were knowledgeable and interested, the products were quite expensive, the legal hoops were quite pronounced. There were lots of hurdles, paperwork and so forth,"" Professor Lintzeris says. ""Most of our respondents were working. They were people who were holding down jobs, mums and dads with kids. So engaging with illicit activities such as that was a concern."" Life Matters listeners shared stories of similar hurdles: ""I have a well noted and long-term chronic pain condition, which has proven relief with CBD. Yet I have been constantly stymied in my attempts to get it prescribed. Thus I am forced to go through the black market with all its problems."" ""My husband was prescribed medicinal cannabis for his cancer pain — incredibly expensive — around $350 for a very small bottle that may last a couple of months only. It was very helpful but we just couldn't afford to keep buying it."" ""I'd rather be using medical cannabis than opium products any day. But it is so expensive to access legally and yet opium products are subsidised by the government. The addiction story for opioids is horrendous. Cognitive dissonance [is] the right word for our culture."" Access to legal medicinal cannabis is granted under the Special Access Scheme. It's managed by the Therapeutic Goods Administration, and you need a restricted prescription for it. The application needs to be done by a doctor on your behalf, and it must show you have a medical reason for accessing cannabis. Between the start of 2020 and May 31, more than 18,000 applications for medical cannabis were approved by the TGA. Professor Lintzeris says the system has adapted and improved since medical cannabis was legalised at the federal level in 2016. Initially people would face wait times of up to two months for approval, he says, but now that's more like two to four weeks — and that's not the only change. ""I think we're seeing some changes in the development of the marketplace, as more doctors take up this option and get better educated around what medical cannabis is, as the price of products is reducing and as more products come onto the market, and there's more and more consumers who are getting experienced with legal supplies,"" Professor Lintzeris says. But he argues that some areas of the law are still lagging behind. Driving with THC in your system is a criminal offence, even if you've been prescribed medical cannabis. After a tenure affected by trauma and threats, this magistrate stepped down because he could no longer apply NSW's drug driving laws. The standard advice for cannabis patients is to wait five days before driving, or risk a fine or a suspended licence, but there is ongoing debate about how much impairment THC actually causes.  ""There's this inconsistency in Australia where we have a group of drug driving laws that really reflect what made sense for illicit cannabis or drug use,"" Professor Lintzeris says. ""Unfortunately, a THC-based medicine gets caught up in that drug driving. We have this anachronism in Australia where no other medication that's legally prescribed is subject to the same drug driving issues as medical cannabis."" It's something that proved a huge worry for Grace. ""My biggest concern was that if I was to get pulled over while driving, if I registered for THC in a random drug test, I could lose my licence,"" she says. Like Grace, Professor Lintzeris also points out that that if you're self-medicating rather than going through a doctor, there are risks. ""There's no capacity of standardisation of product or quality control, both in terms of what's in this batch, how much THC or CBD in this batch compared to the batch from last month,"" he says. Despite the legalisation of medicinal cannabis in Australia, group bodies such as the Royal Australian College of General Practitioners (RACGP) continue to take a cautious stance on prescribing medicinal cannabis patients, calling for more high-quality research into the safety and effectiveness of it. The RACGP pointed Life Matters to a statement, which said it doesn't ""recommend the use of cannabis products"", but does ""recognise that a specialist GP may offer to prescribe it to a limited number of patients"". How important is it to eat and sleep at the same time each day? After four months using CBD oil through an illicit producer, Grace is willing to accept the risks. ""I do find that there is little to no side-effects of using the cannabis oil — which was a concern initially — and it's a cost-effective option,"" she says. ""When I went down that [medical] channel, what I found was that there were a lot of hoops I had to jump through, a lot of paperwork, and a lot of people who had to be involved.  ""And even then if I was deemed worthy of the CBD oil, I was going to be sent this particular oil every six weeks. ""But the illegal CBD oil I got straight away, it was very easy to access and cost effective. So I opted to stay using the illegal source."" *Name changed to protect the person's identity. Get more stories that go beyond the news cycle with our weekly newsletter. We acknowledge Aboriginal and Torres Strait Islander peoples as the First Australians and Traditional Custodians of the lands where we live, learn, and work. This service may include material from Agence France-Presse (AFP), APTN, Reuters, AAP, CNN and the BBC World Service which is copyright and cannot be reproduced. AEST = Australian Eastern Standard Time which is 10 hours ahead of GMT (Greenwich Mean Time)",17,1328
