url,headline,date,body,headline_word_count,body_word_count
https://www.abc.net.au/news/2019-03-09/medicinal-cannabis-and-ageing/10824750,Elderly people breaking the law to use medicinal cannabis for the aches and pains of ageing,Fri 8 Mar 2019 at 8:00pm," Elderly people breaking the law to use medicinal cannabis for the aches and pains of ageing The Liberal Party has announced its formal opposition to the federal government's model for an Indigenous Voice to Parliament Peter Dutton is speaking on the Liberal Party's opposition to the government's model for an Indigenous Voice to Parliament Keep up with the latest ASX and business news Sixty-five-year-old Julie has never smoked a joint in her life but has started treating herself with medicinal cannabis for pain. ""I did have cancer and as a result I have neuropathy [nerve pain] in my feet, and arthritis in my fingers, and since I've been using medicinal cannabis that is starting to improve,"" Julie said, who did not want to use her real name. ""The big one though is I have sports injuries — spinal and ligament wear and tear — and now my pain is 95 per cent healed."" Julie has been taking two drops a night of a cannabinoid oil and a paste with a low tetrahydrocannabinol (THC) dose under her tongue in the morning. She is one of a growing number of senior Australians who are buying homemade medicinal cannabis products for pain relief, despite it being early days in scientific research to support the drug's effectiveness. While there is a legal process for using medicinal cannabis, it can only be prescribed by a medical practitioner and this is done on a case-by-case basis. General practitioners can apply to the Therapeutic Goods Administration (TGA) for approval for a script for individual patients or can become authorised prescribers. To date the TGA has approved applications for chemotherapy-induced nausea and vomiting, paediatric epilepsy, cancer pain, anorexia, and in some cases of palliative care. Although research projects are underway in Australia and internationally, to date there has been mixed evidence that medicinal cannabis is effective for pain relief. One of the reasons for the intense interest to find out more is that we know our own bodies make cannabinoids — chemical messengers that are important to our physiology. Perminder Sachdev, a neurophysicist and co-director of the Centre for Healthy Brain Ageing (CHeBA) at the University of New South Wales in Sydney, said humans had receptors for cannabis in the body: CB1 and CB2 receptors. ""The CB1 receptor is present in the hippocampus and in other regions of the brain, and the hippocampus is quite important for memory,"" Scientia Professor Sachdev said. The CB2 receptor is present on white blood cells, which are important for managing inflammation and immunity. ""We know that the activation of these receptors does lead to the reduction of some chemicals in the brain, and there is a reduction of inflammation in the brain,"" Scientia Professor Sachdev said. ""So, people have wondered what role these receptors, or any drugs that act on these receptors, could be playing in relation to brain function."" Medicinal cannabis pilot studies include research on pain relief, managing behaviour problems in dementia patients, relief for people with Crohn's Disease and animal studies to see if cannabis can prevent Alzheimer's Disease. A year ago, 70-year-old pensioner Paula Vam Vas had a fall, tore the meniscus cartilage in her right knee, and was placed on a public hospital waiting list for surgery. ""It was really painful and the option my doctor gave was [Panadeine] Forte and other opiates for the pain and for sleeping,"" Ms Vam Vas said. ""I didn't want to take them, but the pain was quite severe."" A long-term advocate for decriminalising marijuana, Ms Vam Vas decided to try a cannabinoid oil that had small amounts of THC, the psychoactive ingredient of cannabis. ""So, it doesn't get you stoned,"" Ms Vam Vas said. She was adamant the relief she felt was genuine and not due to a placebo effect. ""Until I took it, I wasn't convinced that it was going to work … it [her knee] hurt so bad,"" Ms Vam Vas said. ""But it put me to sleep, while I was asleep the pain stopped, and during the day I took it at different times when I could feel the pain coming on and it gave me really good relief."" Working through a legal process to access medicinal cannabis was not an option for Ms Vam Vas. ""My doctor doesn't want to know about it and the doctors that can prescribe it are few and far between, and it's very expensive,"" she said. ""What I would pay $90 a month for, would be around $200."" Recently Ms Vam Vas stopped treating herself with medicinal cannabis. This was, she said, because a friend using it to ease the effects of chemotherapy was pulled over by the police and charged with driving with illicit drugs present. ""The interesting thing about it is you're not charged with driving under the influence of a drug, you are charged with having an illegal drug in your system, it doesn't matter to what degree,"" Ms Vam Vas said. Ms Vam Vas has tried to manage her pain without the use of drugs, but said when it became unbearable, she took the Panadeine Forte that her doctor prescribed. ""He's happy to give it to me because he knows I'm in pain,"" Ms Vam Vas said. ""It certainly knocks me out, it's terrific like that, but if I had been taking it all year I wonder what effect it would have on my kidneys, my liver, my bowel and my stomach."" Leah Bisiani, a registered nurse who specialises in the care of elderly people in nursing homes, has become an advocate for more research into medicinal cannabis products as an alternative pain relief treatment for patients in aged care. ""It is a huge area that has been ineffectively managed for a long time,"" Ms Bisiani said. Residents of aged care facilities were prone to muscular skeletal pain, neuropathic pain, and pain associated with cancer and palliative conditions. ""The majority of our aged care population are on opiate regimes with numerous amounts of additional medication to counter the side effects of the opiates they are on,"" Ms Bisiani said. ""There are the obvious ones like constipation because of codeine, but there are also sedation effects where people become delirious. ""It can cause increased confusion, anxiety and agitation, nausea and it places them at a higher risk of falling."" Ms Bisiani said she believed medicinal cannabis had fewer side effects and that anecdotal evidence suggested it was a viable alternative to opiates for pain relief. ""Just like you do with any medication, you need to monitor it effectively, we can change the dosage, so we can meet the individual needs. ""The safeguards already in place for opiate regimes could apply to medicinal cannabis regimes."" As of January 31, 2019 only 54 doctors across Australia were registered as approved prescribers of medicinal cannabis. The TGA said because of the small numbers it could not provide information on how many of these doctors practised in regional Australia. A TGA spokesperson said more than 3,500 people had been approved to access medicinal cannabis under the Special Access Scheme.  In a statement, they said it was ""important to note that the TGA does not vouch for the quality, safety and effectiveness of unapproved medicinal cannabis products"". The Australian Medical Association (AMA) has consistently said the effectiveness of medicinal cannabis for treating pain and other health problems was still not proven. ""We don't know enough yet,"" Dr Kean Seng Lim said, NSW AMA president. ""All doctors tend to be conservative and err on the side of safety and that is entirely appropriate, to make sure as doctors we first do no harm to our patients. ""We really need to wait for the results of these trials to come out before we can make an educated choice on this matter."" In a 2016 report by the Australian Institute of Health and Welfare, 85 per cent of Australians were found to favour the use of cannabis for medicinal purposes. Internationally, 30 countries have given the green light to medicinal cannabis in some capacity. There is only one medicinal cannabis product on the Australian Register of Therapeutic Goods, which was approved for use in some patients with muscle spasm resulting from multiple sclerosis. Michael Balderston from the Hemp Embassy in Nimbin on the NSW north coast said the legal access the Australian Government had provided to medicinal cannabis products was too limited. ""They made it a tiny gateway … it's like the chain is still on the gate,"" Mr Balderston said. ""It's extremely hard to get permission through your doctor, [there are] lots of forms, two levels of doing it in some states, so I think doctors aren't inclined to do it and it has to be a really serious condition."" Mr Balderston also claimed the current research was not adequately testing the homegrown products that he believed were superior to the pharmaceutical cannabis products used in most clinical trials. ""So, people are finding ways to access it across Australia."" Mr Balderston advocated a licensing system for the cottage industry of people growing and making medicinal cannabis, with quality testing and limitations on supply. When challenged on the need for a health professional to know exactly what was in a drug to safely administer it, Mr Balderston said ""we could be telling people exactly what is in it, if we were allowed to test people's medicine that they are making"". ""It's a massive 'hemp-ployment', we call it,"" he said. In response to Mr Balderston's statements, the TGA said a medicinal cannabis product was required to meet the Therapeutic Goods Order (TGO) 93, which ensured the product did not contain more than defined limits for contaminants. The TGA also clarified that medicinal cannabis products being supplied via the Special Assistance Scheme and the approved prescriber pathways were ""unapproved products that have not been evaluated by the TGA for safety, quality and effectiveness"". In the meantime, it seems many senior Australians are choosing not to wait for scientific evidence to back up their personal experience. ""Where I got my medicinal cannabis, they supply probably 200 people a week, I would say 90 per cent of them have never had marijuana in their life, they've never taken an illegal drug in their life and they're ageing,"" Ms Vam Vas said. ""The fact that it's an illegal substance, that really disturbs me,"" Julie said. ""I hate having to live like this, but the benefits are so great I have to continue to break the law, because while it works I'll keep using it."" We acknowledge Aboriginal and Torres Strait Islander peoples as the First Australians and Traditional Custodians of the lands where we live, learn, and work. This service may include material from Agence France-Presse (AFP), APTN, Reuters, AAP, CNN and the BBC World Service which is copyright and cannot be reproduced. AEST = Australian Eastern Standard Time which is 10 hours ahead of GMT (Greenwich Mean Time)",16,1818
https://www.abc.net.au/news/2021-03-18/tasmania-cannabis-scheme-explainer/100015178,"Tasmanian GPs will soon be able to prescribe medicinal cannabis, but fast access is still a while away",Wed 17 Mar 2021 at 9:57pm," Tasmanian GPs will soon be able to prescribe medicinal cannabis, but fast access is still a while away The Liberal Party has announced its formal opposition to the federal government's model for an Indigenous Voice to Parliament Peter Dutton is speaking on the Liberal Party's opposition to the government's model for an Indigenous Voice to Parliament Keep up with the latest ASX and business news Tasmanians will soon be able to visit their general practitioner and request a prescription for medicinal cannabis — but while the State Government says that option will be available from July 1, it might not be quite that simple. Tasmania is the only jurisdiction in Australia where GPs can not prescribe medicinal cannabis to patients. Patients can only get legal access to the drug through a medical specialist, like a neurologist. From September 2017 to August 2020, only 16 Tasmanians were legally prescribed medicinal cannabis through the state's Controlled Access Scheme. Medicinal cannabis advocates and politicians, including Tasmanian MLC Ivan Dean and Tasmanian Labor senators Anne Urquhart and Catryna Bilyk have long called for Tasmania's scheme to be improved. A Senate Inquiry tasked with investigating the ""current barriers to patient access to medicinal cannabis in Australia"" also recommended early last year that the state fall in line with other jurisdictions. On Monday, the Tasmanian Government announced in its State of the State address it would do that. From July 1, Tasmanian GPs will be able to seek permission through the Therapeutic Goods Administration to prescribe medicinal cannabis to patients. Tasmanian Premier Peter Gutwein uses his State of the State address to announce a raft of new funding for mental health, housing, training and construction in response to a COVID-19 recovery report. GPs will need to apply for each patient individually through the national streamlined online application pathway and they will receive authorisation as to whether they can prescribe within 48 hours. Patients who are successfully prescribed medicinal cannabis through a GP will then get their script filled at private pharmacies. Currently, all prescribed medicinal cannabis through the Controlled Access Scheme is dispensed at Tasmanian Health Service pharmacies in hospitals and is given out a heavily subsidised rate by the State Government. Specialists will still be able to prescribe under the changes and it is understood patients who get scripts that way will still get medication at a subsidised rate. Northern Tasmanian mother Lyn Cleaver has been trying to get her son Jeremy on the Controlled Access Scheme since it started in 2017. She said cannabis helped him with his epilepsy. Ms Cleaver said the changes were ""desperately needed"" so people didn't have to turn to the illegal market. ""The scheme as it stands at the moment is effectively pushing people to the alternative market,"" Ms Cleaver said. ""Getting in to see a specialist takes a long time, up to 12 months sometimes, so it will be good if patients can speak to their GPs and I assume many patients will be looking to utilise this new scheme,"" she said. ""But the issue remains around availability and affordability."" Ms Cleaver said supply of medicinal cannabis interstate was not consistent and she had heard of many Australians left waiting for product due to supply shortages. She said some bottles of prescription medicinal cannabis were costing Australians $300 and medicine would sometimes last less than a week. She said her family was still considering whether they would seek a prescription for Jeremy through a doctor. ""I'm not sure whether we could afford to do it for Jeremy,"" she said. ""Patients a lot of the time are on a disability support pension, so there's not a lot of money to spare to start with, so that's going to be an issue."" Dr Tim Jackson, who is the chairman of the Tasmanian branch of The Royal Australian College of General Practitioners, said while there's ""no doubt"" some doctors will want to prescribe medicinal cannabis, many would need more education first. ""It's confusing at the moment, there's no direct clinical guidelines, so I think that's why most GPs would be a bit cautious about prescribing something like this until there's a bit more information,"" Dr Jackson said. ""The problem from a general practice point of view is we're not entirely sure about the safety and the efficacy of medicinal cannabis, although there is more information becoming available,"" he said. ""I wouldn't expect any GPs to be able to prescribe medicinal cannabis in the short term, so I'd encourage patients not to have the expectation that you can now go to your GP and get medicinal cannabis ... it's probably going to take, in reality, six to nine months, even 12 months probably."" He said trying to educate GPs about medicinal cannabis at the same time they learnt about the coronavirus vaccine would also be difficult. ""At the end of day whatever happens, it needs to be done systematically and safely,"" Dr Jackson said. Pharmacy Guild of Australia Tasmania branch president Helen O'Byrne said the scheme change was welcome news, but agreed there was still work to do first. She said there were currently a limited range of medicinal cannabis products in Australia that had been approved for sale by the Therapeutic Goods Administration. ""It means that the doctor and the pharmacy will need to apply to import that product specifically for the patient and get special permission from the government,"" Ms O'Byrne said. ""There's lots of paper work involved and it's quiet an expensive process for the patient, but it does mean if all those boxes get ticked, that people will be able to access medicinal cannabis."" Ms O'Byrne said there was still consultation that needed to happen between the Tasmanian Government, pharmacists and GPs before the changes to the scheme changes were implemented. Ms Cleaver said in the near future the State Government also needed to consider how people using prescribed medicinal cannabis could use a motor vehicle. ""At the moment, if you have THC in your system you can't drive, so that will need to be looked at,"" Ms Cleaver said. She said the Tasmanian Government also needed to look at better legal protections for people who had no choice but to grow their own medicinal cannabis. The senate committee investigating the barriers to medicinal cannabis access last year recommended amnesties for the possession and/or cultivation of cannabis for genuine self-medication purposes be looked at. It also recommended drug driving laws and their implications for patients with legal medicinal cannabis prescriptions be reviewed. We acknowledge Aboriginal and Torres Strait Islander peoples as the First Australians and Traditional Custodians of the lands where we live, learn, and work. This service may include material from Agence France-Presse (AFP), APTN, Reuters, AAP, CNN and the BBC World Service which is copyright and cannot be reproduced. AEST = Australian Eastern Standard Time which is 10 hours ahead of GMT (Greenwich Mean Time)",18,1149
https://www.abc.net.au/radionational/programs/lifematters/critics-say-medical-cannibis-regulation-is-failing-patients/10853632,Critics say medicinal cannabis regulation is failing patients,Mon 4 Mar 2019 at 10:06pm,"Medicinal cannabis has been legal in Australia for three years, but patients say access still isn't guaranteed despite changes to the law. Like other drugs, medicinal cannabis is regulated by the Therapeutic Goods Administration, but critics say the system isn't working. Lucy Haslam is a retired nurse and the executive director of United in Compassion which she co-founded when her son Dan found cannabis was the only thing that eased the side effects of his cancer treatment. And Iain McGregor is professor of psychopharmacology, and academic director of the Lambert Initiative for Cannabinoid Therapeutics at Sydney University which was established to further the research into medicinal cannabis. In a statement, the TGA says ""the regulatory framework for medicinal cannabis balances access to unapproved products with appropriate safeguards for the Australian public"". In this episode  Published: 4h agoTue 4 Apr 2023 at 11:43pm  Published: 4h agoTue 4 Apr 2023 at 11:27pm  Published: 5h agoTue 4 Apr 2023 at 11:06pm  Published: MonMon 3 Apr 2023 at 11:43pm We acknowledge Aboriginal and Torres Strait Islander peoples as the
    First Australians and Traditional Custodians of the lands where we
    live, learn and work.",8,189
https://www.abc.net.au/triplej/programs/hack/can-medicinal-cannabis-cure-symptoms-period-pain-endometriosis/11873296,Could medicinal cannabis be the new frontier in treating period pain?,16 Jan 2020,"As those of us who've groped around our bathroom cabinets for anti-inflammatories while clutching heat packs to our aching abdomens know, sometimes being a woman is a massive pain. Literally. Dysmenorrhea - AKA  period pain - is incredibly common and in one out of five cases can be so severe it stops you from doing your daily activities. Dr Mike Armour from the National Institute of Complementary Medicine (NCIM) Health Research Institute at Western Sydney University, says period pain is especially prevalent in young women. About 90 per cent of Australian women under 25 suffer from period pain on a relatively regular basis. Despite that, there's not a whole lot of science or research into the condition. ""I think there's been a culture of silence around periods which means they can't be discussed. I often say that I can't talk about my research around the dinner table,"" Dr Armour told Hack. ""Women perhaps also don't know their periods are problematic or abnormal because they're often told by their mums, their friends or even their doctors that period pain is just normal, it's just part of being a woman and you just need to suck it up,"" he explains. Dr Armour says existing treatments for period pain, like over the counter pain medication, anti-inflammatories, heat packs and exercise, have their limitations. ""A lot of women say they remove some of my pain, but not all of it."" So he and fellow NICM researcher Justin Sinclair are looking at other treatments. Like medicinal cannabis. The pair conducted a small survey late last year on how women with endometriosis, a chronic and painful condition, manage their symptoms. Cannabis was brought up a lot. ""Over 50 per cent of women who were utilising cannabis for their symptoms in the survey, which was about one in 10, had a reduction of 50 per cent of their pharmaceutical usage,"" Mr Sinclair told Hack. ""They also showed fairly significant improvements across the domains of things like anxiety, depression, sleep, nausea, vomiting and gastro-intestinal upsets. These are fairly common symptoms that women with endometriosis experience,"" he says. Have you used cannabis to treat period pain? Tell us about your experience via DM or email at hack@abc.net.au  It led the pair to question whether medicinal cannabis had applications for primary dysmenorrhea - that is, period pain that's not caused by other conditions like endometriosis or polycystic ovarian syndrome (PCOS). ""We're running some focus groups to find out what women are currently using, how they're managing their pain, what impact it's having and then have a discussion about how they would feel about using something like medicinal cannabis,"" Dr Armour says. You don't have to have previously used cannabis to manage pain to take part in the focus group. ""We're looking for around 20 women aged 18 to 45, and they need to have moderate or greater period pain and they need to have no known cause for that period pain such as a diagnosis of endometriosis."" The results of that focus group will determine if there's enough evidence to progress to a clinical trial. If you're interested in participating in the focus group, you can find out more here. Mr Sinclair says medicinal cannabis is hard to access for pain relief. ""There are doctors that are prescribing legal medicinal cannabis for endometriosis at the moment... They prescribe for chronic pain in adults, and what doctors can do is they can put in chronic pain secondary to endometriosis."" But it's still rare. ""I've got three doctors that have contacted me now saying they've all had successful applications for that."" Mr Sinclair says finding a doctor to prescribe medicinal cannabis remains one of the biggest barriers for patients. ""Their doctors might not be educated...They might be dismissive to their patients,"" he says. Even if patients find an authorised prescriber of medicinal cannabis, the impact on their wallets can make them think twice. The cost around legal cannabis can be anywhere between $250 and $350 a month, which is larger than you'd pay in the illicit market. Mr Sinclair says stigma, and concern over breaking the drug-driving laws or workplace health and safety requirements, are the other barriers. ""Currently if you got pulled over and tested by a roadside drug test, theoretically the police would still be able to prosecute you. Obviously, it would go to court, and we're not sure what would happen there, but there's no changes to the drug-driving laws for medicinal cannabis laws,"" he says. The ACT last year legalised cannabis for recreational use. Those laws will come into place at the end of January. However, the territory has not altered its drug-driving laws, and drivers can still be tested for traces of cannabis. We acknowledge Aboriginal and Torres Strait Islander peoples as the
  First Australians and Traditional Custodians of the lands where we
  live, learn and work.",11,810
