url,headline,date,body,snippet,headline_word_count,body_word_count
https://www.sbs.com.au/news/article/secret-vic-lab-growing-medicinal-cannabis/9jse0w6yg,Secret Vic lab growing medicinal cannabis,,"Victoria will fast-track its rollout of medicinal cannabis to help children with severe epilepsy. (AAP) Australia Culture Life Australia Australia Politics Australia Arts Morning (Mon–Fri) Afternoon (Mon–Fri) Weekend By subscribing, you agree to SBS’s terms of service and privacy policy including receiving email updates from SBS.","Apr 19, 2016 ... Medicinal cannabis is being successfully grown in a secret Victorian location ahead of the drug being made available for sick children next ...",6,46
https://www.sbs.com.au/news/article/spotlight-to-be-placed-on-barriers-to-medicinal-cannabis-in-australia/k6ikxi91s,Spotlight to be placed on barriers to medicinal cannabis in Australia,,"Health Minister Greg Hunt inspects cannabis plants at the opening of Medifarm on the Sunshine Coast. Source: AAP Possession, growing of cannabis given the green light in Canberra Immigration Australia Arts Australia Life Australia Politics Australia Morning (Mon–Fri) Afternoon (Mon–Fri) Weekend By subscribing, you agree to SBS’s terms of service and privacy policy including receiving email updates from SBS.","Nov 15, 2019 ... The barriers facing patients accessing medicinal cannabis will be placed under scrutiny during a Parliamentary inquiry into how Australia ...",11,59
https://www.sbs.com.au/news/article/concerns-over-medicinal-cannabis-use/24hqddhri,Concerns over medicinal cannabis use,,"File image. (AAP) Source: EFE COVID-19 Australia Politics Welfare Australia World Culture Australia Morning (Mon–Fri) Afternoon (Mon–Fri) Weekend By subscribing, you agree to SBS’s terms of service and privacy policy including receiving email updates from SBS.","Mar 30, 2015 ... A parliamentary inquiry has heard palliative care experts are not convinced draft laws legalising medicinal cannabis are in patients' best ...",5,36
https://www.sbs.com.au/news/insight/article/women-with-endometriosis-are-turning-to-cannabis-to-ease-their-pain/7xc3zayzd,Women with endometriosis are turning to cannabis to ease their pain,," Source: Getty Images Politics Australia Australia Life COVID-19 Politics Australia World Morning (Mon–Fri) Afternoon (Mon–Fri) Weekend By subscribing, you agree to SBS’s terms of service and privacy policy including receiving email updates from SBS.","Nov 12, 2019 ... Is it legal? Medical practitioners in Australia can legally prescribe medicinal cannabis through regulated pathways such as the. Special Access ...",11,34
https://www.sbs.com.au/news/article/australias-first-medicinal-cannabis-trial-to-begin-in-newcastle-next-year/m18zdipkj,Australia's first medicinal cannabis trial to begin in Newcastle next year,,"A man cutting leaves of marijuana to produce medicinal products Source: AAP Australia Australia Australia Australia Australia COVID-19 World Australia Morning (Mon–Fri) Afternoon (Mon–Fri) Weekend By subscribing, you agree to SBS’s terms of service and privacy policy including receiving email updates from SBS.","Jul 27, 2015 ... The NSW government has announced the first trial into medicinal cannabis will begin in early next year at a Newcastle hospital.",11,43
https://www.sbs.com.au/news/article/gps-in-the-dark-about-medicinal-cannabis/v7lfgplv0,GPs in the dark about medicinal cannabis,,"Most Australian GPs feel their knowledge about medicinal cannabis is inadequate. (AAP) Australia Australia Arts Life Culture Australia Culture Immigration Morning (Mon–Fri) Afternoon (Mon–Fri) Weekend By subscribing, you agree to SBS’s terms of service and privacy policy including receiving email updates from SBS.","Jul 4, 2018 ... A survey of GPs shows that while most support the prescribed use of medicinal cannabis for their patients, they lack the training to help ...",7,43
https://www.sbs.com.au/news/article/pm-rules-out-medicinal-cannabis-amnesty/kjbxxvhjg,PM rules out medicinal cannabis amnesty,,"Malcolm Turnbull says he hasn't received an invitation to attend Donald Trump's inauguration. (AAP) Source: AAP Australia Life Arts Australia COVID-19 World Culture Australia Morning (Mon–Fri) Afternoon (Mon–Fri) Weekend By subscribing, you agree to SBS’s terms of service and privacy policy including receiving email updates from SBS.","Jan 17, 2017 ... Malcolm Turnbull has ruled out an amnesty on medicinal cannabis, saying it would be ""irresponsible"" for the government to do so.",6,47
https://www.sbs.com.au/news/article/medicinal-cannabis-bill-passes-senate/e805r8851,Medicinal cannabis bill passes Senate,,"Engineering firm slammed for taking 'toxic' Nauru contract Canada's Quebec bans face veils for public servants Wilkie refers Crown Casino pokie tampering allegations to police Australia Politics Arts COVID-19 World Australia Australia Australia Morning (Mon–Fri) Afternoon (Mon–Fri) Weekend By subscribing, you agree to SBS’s terms of service and privacy policy including receiving email updates from SBS.","Oct 19, 2017 ... A Greens' private bill to make importing medicinal cannabis easier has passed the Senate, but the government plans to block the changes in ...",5,56
https://www.sbs.com.au/news/article/medicinal-cannabis-treats-dravet-syndrome/vv3fogx5s,Medicinal cannabis treats Dravet syndrome,,"A medicinal cannabis trial has shown cannabidiol reduces seizures in a rare form of epilepsy. (AAP) COVID-19 World Culture Culture Australia Australia Politics Welfare Morning (Mon–Fri) Afternoon (Mon–Fri) Weekend By subscribing, you agree to SBS’s terms of service and privacy policy including receiving email updates from SBS.","May 25, 2017 ... A medicinal trial has shown cannabidiol (CBD) significantly reduces seizures in children with the rare genetic brain dysfunction and can even ...",5,47
https://www.sbs.com.au/news/article/medicinal-marijuana-to-be-legalised-in-victoria/h4yfy6g6v,Medicinal marijuana to be legalised in Victoria,,"The Victorian opposition has given in-principle support to trialling medical marijuana. (AAP) Medical marijuana credited with girl's 'miracle' recovery Immigration Welfare Life Australia Australia Australia Australia Australia Morning (Mon–Fri) Afternoon (Mon–Fri) Weekend By subscribing, you agree to SBS’s terms of service and privacy policy including receiving email updates from SBS.","Oct 6, 2015 ... The Victorian government wants to provide a legal supply of medicinal cannabis for severely epileptic children from 2017, in a national ...",7,50
https://www.sbs.com.au/news/article/nsw-improves-medicinal-cannabis-access/9l1jr1yc5,NSW improves medicinal cannabis access,,"COVID-19 World Australia Culture Politics Australia Australia Australia Morning (Mon–Fri) Afternoon (Mon–Fri) Weekend By subscribing, you agree to SBS’s terms of service and privacy policy including receiving email updates from SBS.","Mar 2, 2018 ... Doctors will get quicker approval of medical marijuana prescriptions under a streamlined process announced by the NSW and federal ...",5,31
https://www.sbs.com.au/news/article/qld-gets-medicinal-cannabis-guidelines/7lzevufus,Qld gets medicinal cannabis guidelines,,"Queensland has released Australia's first clinical guidelines for the use of medicinal cannabis. (AAP) World Australia World Australia Politics Culture Culture Politics Morning (Mon–Fri) Afternoon (Mon–Fri) Weekend By subscribing, you agree to SBS’s terms of service and privacy policy including receiving email updates from SBS.","Jan 26, 2017 ... Mr Dick said they included details about where to source medicinal cannabis, dosages and different treatment regimes. ""Medical practitioners ...",5,45
https://www.sbs.com.au/news/article/plans-for-medicinal-cannabis-hub-in-qld/9mx7dl5jo,Plans for medicinal cannabis hub in Qld,,"COVID-19 Politics Arts Australia Australia Australia Australia Politics Morning (Mon–Fri) Afternoon (Mon–Fri) Weekend By subscribing, you agree to SBS’s terms of service and privacy policy including receiving email updates from SBS.","Apr 30, 2018 ... A Queensland medicinal cannabis company wants to build a hub for other manufacturers to steer growth of the emerging national industry.",7,31
https://www.sbs.com.au/news/article/victoria-moves-closer-to-medicinal-cannabis-use/jxa2zh3lo,Victoria moves closer to medicinal cannabis use,,"Victoria moves closer to medicinal cannabis use  Politics World Arts Australia Australia Australia COVID-19 Australia Morning (Mon–Fri) Afternoon (Mon–Fri) Weekend By subscribing, you agree to SBS’s terms of service and privacy policy including receiving email updates from SBS.","Oct 8, 2015 ... Victoria is set to become the first state in Australia to legalise cannabis for medical use.",7,38
https://www.sbs.com.au/news/article/qld-moves-to-legalise-medicinal-cannabis/4oz1dmcnc,Qld moves to legalise medicinal cannabis,,"A bill allowing medicinal cannabis in Queensland will be introduced by Health Minister Cameron Dick. (AAP) World World Culture Welfare Australia Australia Politics Culture Morning (Mon–Fri) Afternoon (Mon–Fri) Weekend By subscribing, you agree to SBS’s terms of service and privacy policy including receiving email updates from SBS.","May 10, 2016 ... Queensland's health minister has introduced legislation into parliament to legalise the production and use of medicinal cannabis.",6,47
https://www.sbs.com.au/news/article/access-to-medicinal-cannabis-to-get-easier/diiabws4m,Access to medicinal cannabis to get easier,,"Ill Australians will be able to access medicinal cannabis more quickly under new importation laws. (AAP) Life Welfare Politics Culture Arts COVID-19 Culture Australia Morning (Mon–Fri) Afternoon (Mon–Fri) Weekend By subscribing, you agree to SBS’s terms of service and privacy policy including receiving email updates from SBS.","Feb 22, 2017 ... Australia could have a healthy stock of medicinal cannabis within eight weeks with the federal government to ease importation laws to meet ...",7,47
https://www.sbs.com.au/news/article/medicinal-cannabis-forum-set-for-brisbane/xmizjcdws,Medicinal cannabis forum set for Brisbane,,"A Brisbane forum will hear from Lanai Carter, whose son has been given access to medicinal cannabis. (AAP) Australia COVID-19 Australia Life Australia Australia Arts Australia Morning (Mon–Fri) Afternoon (Mon–Fri) Weekend By subscribing, you agree to SBS’s terms of service and privacy policy including receiving email updates from SBS.","Oct 26, 2017 ... A woman whose son was the first person in Queensland to be given access to medicinal cannabis is worried about the way regulators are going.",6,49
https://www.sbs.com.au/news/article/cannabis-suppliers-shares-high-after-ipo/n3g6obc6x,Cannabis supplier's shares high after IPO,,"Althea will use the funds to grow about three tonnes of dried medicinal cannabis flowers per year. (AAP) Australia Australia Culture Australia Welfare Australia Immigration Australia Morning (Mon–Fri) Afternoon (Mon–Fri) Weekend By subscribing, you agree to SBS’s terms of service and privacy policy including receiving email updates from SBS.","Sep 21, 2018 ... Shares in medicinal cannabis supplier Althea Group have gone sky high as the Melbourne-based company makes its debut on the ASX.",6,49
https://www.sbs.com.au/news/article/victoria-makes-medicinal-cannabis-legal-in-historic-move/gxqmuezsi,Victoria makes medicinal cannabis legal in historic move,,"File photo Source: AAP Australia Australia Immigration Culture World Politics World Australia Morning (Mon–Fri) Afternoon (Mon–Fri) Weekend By subscribing, you agree to SBS’s terms of service and privacy policy including receiving email updates from SBS.","Apr 12, 2016 ... Children with severe epilepsy will be given first access to medicinal cannabis from early 2017 following the passing of new laws in ...",8,35
https://www.sbs.com.au/news/article/senate-scraps-rules-on-medicinal-cannabis/8pzhowe0d,Senate scraps rules on medicinal cannabis,," Source: AAP Australia COVID-19 Politics Australia Welfare Australia Australia World Morning (Mon–Fri) Afternoon (Mon–Fri) Weekend By subscribing, you agree to SBS’s terms of service and privacy policy including receiving email updates from SBS.","Jun 13, 2017 ... Rules making it harder for dying patients to access medicinal cannabis have been overturned by the Senate.",6,33
https://www.sbs.com.au/news/article/wa-govts-medicinal-cannabis-move-welcomed/x8k9iy9uw,WA govt's medicinal cannabis move welcomed,,"File image Source: EPA Australia Culture Arts COVID-19 World World Australia Australia Morning (Mon–Fri) Afternoon (Mon–Fri) Weekend By subscribing, you agree to SBS’s terms of service and privacy policy including receiving email updates from SBS.","Oct 28, 2016 ... The WA opposition and Greens have welcomed the Barnett government's decision to embrace medicinal cannabis, while Epilepsy WA says it should ...",6,35
https://www.sbs.com.au/news/article/mcgowan-to-discuss-medicinal-cannabis/xgrquh4t7,McGowan to discuss medicinal cannabis,,"Australia Australia Australia Australia Life Australia World Culture Morning (Mon–Fri) Afternoon (Mon–Fri) Weekend By subscribing, you agree to SBS’s terms of service and privacy policy including receiving email updates from SBS.","May 21, 2017 ... The West Australian premier and health minister will meet with medical leaders to raise awareness about medicinal cannabis.",5,31
https://www.sbs.com.au/news/article/nsw-government-rejects-medicinal-cannabis/8k5e1thrh,NSW government rejects medicinal cannabis,,"Australia Culture Australia Australia COVID-19 Life Australia Politics Morning (Mon–Fri) Afternoon (Mon–Fri) Weekend By subscribing, you agree to SBS’s terms of service and privacy policy including receiving email updates from SBS.","Nov 16, 2013 ... Last November the NSW government established a parliamentary inquiry into the use of cannabis for medical purposes. The bipartisan committee ...",5,31
https://www.sbs.com.au/news/article/momentum-growing-for-medicinal-cannabis/tcdga64cm,Momentum growing for medicinal cannabis,,"Australia Australia Australia Australia Politics Arts COVID-19 Australia Morning (Mon–Fri) Afternoon (Mon–Fri) Weekend By subscribing, you agree to SBS’s terms of service and privacy policy including receiving email updates from SBS.","Jul 23, 2014 ... NSW may be a step closer to legalising medicinal cannabis after Premier Mike Baird met a terminally ill cancer patient who is using the drug ...",5,31
https://www.sbs.com.au/news/article/tas-nsw-govts-to-study-medicinal-cannabis/5cgdxpckf,"Tas, NSW govts to study medicinal cannabis",,"Tasmania and NSW have joined forces to research the future use of medicinal cannabis. (AAP) Politics World Australia Australia COVID-19 Australia Culture Australia Morning (Mon–Fri) Afternoon (Mon–Fri) Weekend By subscribing, you agree to SBS’s terms of service and privacy policy including receiving email updates from SBS.","Dec 10, 2015 ... Tasmania and NSW have joined forces to research the future use of medicinal cannabis to treat epilepsy and chemotherapy-induced nausea.",7,46
https://www.sbs.com.au/news/article/medicinal-cannabis-bill-introduced-in-vic/580y1okof,Medicinal cannabis bill introduced in Vic,,"The Victorian government has introduced a bill to legalise medicinal cannabis for exceptional cases. (AAP) Politics COVID-19 Life Australia Immigration Australia World Welfare Morning (Mon–Fri) Afternoon (Mon–Fri) Weekend By subscribing, you agree to SBS’s terms of service and privacy policy including receiving email updates from SBS.","Dec 8, 2015 ... Victorians are one step closer to accessing medicinal cannabis as the state government introduces legislation to legalise the drug for ...",6,46
https://www.sbs.com.au/news/article/first-medicinal-cannabis-shipments-arrive/rqjtg2ohg,First medicinal cannabis shipments arrive,,"Australia Politics Australia Australia Life COVID-19 Politics Australia Morning (Mon–Fri) Afternoon (Mon–Fri) Weekend By subscribing, you agree to SBS’s terms of service and privacy policy including receiving email updates from SBS.","May 3, 2017 ... Children suffering from epilepsy are expected to be among the first to benefit from new commercial shipments of medicinal cannabis products ...",5,31
https://www.sbs.com.au/news/article/vic-makes-medicinal-cannabis-legal/p8dr2wpxc,Vic makes medicinal cannabis legal,,"Victoria is the first state to make medicinal cannabis legal to people in exceptional circumstances. (AAP) Arts World Australia Australia Australia Welfare Australia Life Morning (Mon–Fri) Afternoon (Mon–Fri) Weekend By subscribing, you agree to SBS’s terms of service and privacy policy including receiving email updates from SBS.","Apr 13, 2016 ... Victoria is the first state to make medicinal cannabis legal to people in exceptional circumstances after passing a historic bill in ...",5,47
https://www.sbs.com.au/language/hindi/en/podcast-episode/new-study-examines-medicinal-cannabis-treatment-for-people-with-autism/n8pz8zkor,New study examines medicinal cannabis treatment for people with autism,,World-first study of medicinal cannabis in children with Autism Spectrum Disorder shows a 93 per cent symptom improvement at 20 weeks Source: iStockphoto / Shidlovski/Getty Images/iStockphoto,"Nov 19, 2022 ... World-first study of medicinal cannabis in children with Autism Spectrum Disorder shows a 93 per cent symptom improvement at 20 weeks ...",10,26
https://www.sbs.com.au/news/article/vic-to-lead-nation-on-medicinal-cannabis/8u6gqa7nu,Vic to lead nation on medicinal cannabis,,"World Australia Culture COVID-19 Arts Australia Welfare Australia Morning (Mon–Fri) Afternoon (Mon–Fri) Weekend By subscribing, you agree to SBS’s terms of service and privacy policy including receiving email updates from SBS.","Oct 7, 2015 ... Victoria wants to provide a legal supply of medicinal cannabis for severely epileptic children from 2017 but federal law changes are also ...",7,31
https://www.sbs.com.au/news/article/dickson-praises-medicinal-cannabis-change/smqfyjfun,Dickson praises medicinal cannabis change,,"Australia Arts Welfare Life Politics Australia World Culture Morning (Mon–Fri) Afternoon (Mon–Fri) Weekend By subscribing, you agree to SBS’s terms of service and privacy policy including receiving email updates from SBS.","Feb 22, 2017 ... Queensland One Nation MP Steve Dickson says the federal government decision to make it easier to access medicinal cannabis justifies his ...",5,31
https://www.sbs.com.au/language/filipino/en/podcast-episode/possible-growing-of-medicinal-cannabis/s4cvoixmd,Possible growing of Medicinal Cannabis?,,Medicinal cannabis Source: AAP,"Apr 2, 2016 ... ... effect of cannabis or marijuana to people with epilepsy, cancer, multiple sclerosis and chronic pain. Image: Medicinal cannabis (AAP)",5,4
https://www.sbs.com.au/topics/voices/health/article/2018/03/29/we-were-desperate-family-turns-black-market-medical-cannabis,‘We were desperate’: Family turns to black market for medical cannabis                                  ,,"Alice* watched her four-year-old son Rhys* be loaded onto an air ambulance bound for Sydney, and thought, this can’t go on. It had been the second time in two months that Rhys had been airlifted from his home in Canberra to Sydney for a five-day stay. The month prior, his condition was so bad that Alice and her family had thought they’d lost him. Rhys was born with a chromosome disorder, which means he needs a wheelchair and cannot walk, talk, feed himself nor dress himself. On top of this, he was suffering regular unexplained pain episodes which saw his body stiffen for hours on end.  Rhys had to be flown to hospital when his condition would worsen. Source: Supplied “We were desperate,” Alice says. “There was nothing we could give him apart from opiates to control the pain, but opiates meant [hospital staff] would have to take over his breathing.” She started researching alternative pain relief methods and quickly zoned in on medical cannabis. Via personal networks, she found an Australian-based distributor, and contacted them to purchase a supply, despite not having a prescription.  She started giving Rhys regular doses: starting with one drop morning and evening, and rising to three drops each time. And almost instantaneously, things turned around. “It’s made a huge difference. He’s put on weight, he sleeps better and he hasn’t been in the hospital with pain related issues since we started it,” she says. Alice is one of a growing number of parents giving their children cannabis oil to help mitigate the effects of chronic illnesses. But they do so knowing there is a risk: uneven legislation across states governing the prescription and use of medical cannabis means that some risk fines, even jail, for obtaining, growing or supplying the drug. The Royal Australian College of General Practitioners is one group working hard to ensure the legislation is standardised. ""It’s almost impossible to jump through all these hoops and prescribe cannabis in a timely and reasonable fashion.” “If we look at the scientific evidence, there’s now conclusive and substantive evidence that [medicinal cannabis] is effective in patients with severe and disabling pain,” says Dr Bastian Seidel of the college.  “There’s no nationally consistent regulatory framework covering cannabis. It’s very confusing if you’re a medical practitioner and you feel you’ve exhausted all other avenues to treat a patient, it’s almost impossible to jump through all these hoops and prescribe cannabis in a timely and reasonable fashion.” Marijuana has been decriminalised for medicinal use across the country, yet different states have different laws, and it remains difficult to source.  Marijuana has 113 active chemical components, and when it is processed for medical use, the main psychoactive component THC (Tetrahydrocannabinol) is removed, meaning you can’t get high. It is CBD (cannabidiol) that users want to help treat medical conditions such as multiple sclerosis, epilepsy or pain.  ""It’s had such a positive impact on Rhys and our whole family that I don’t want to lose it."" Still, companies supplying the oil in Australia can face legal action or being shut down. This is precisely what happened to the organisation that initially supplied Alice. After it shut down she looked elsewhere, and now obtains the oil from a company in the Netherlands which sends her packages through the mail. “We’ve had no problems, none of our packages have been held up at Customs, but we know the legalities around it are grey,” she says. According to Alice, the oil doesn’t contain THC and has all ingredients properly listed, however even after looking at the TGA’s website she can’t work out whether it’s legal or not.  The European supply has added benefits: it has a purer taste, meaning Rhys can swallow it comfortably, and it is also thoroughly batch tested, with results available to view online. “It’s had such a positive impact on Rhys and our whole family that I don’t want to lose it,” says Alice. “I’d gotten to the point where I felt like I wasn’t coping. Life was so unpredictable and ending up in hospital for days would really disrupt our lives. I have other children who still need to be picked up from school, I have work deadlines to meet. My other children’s behaviour was starting to deteriorate. Now, they’ve settled a lot. It’s made a huge difference, everybody’s less stressed and I feel we can manage a bit better.”  Alice wants proper regulation so she can be assured of consistent supply and the knowledge she isn’t breaking any laws. “If a medical professional feels it’s appropriate to prescribe medicinal cannabis then they should be able to."" Dr Seidel says obtaining medicines on the black market limits the capacity of the medical profession to monitor how patients respond. “In 2018 it’s completely unacceptable to have to get drugs on the black market,” says Dr Seidel. “If a medical professional feels it’s appropriate to prescribe medicinal cannabis then they should be able to. If it’s being accessed on the black market we don’t know what’s being put in, we don’t know the dose being given, and this isn’t in the interests of the patient, of parents, or of society.” *Names have been changed. The information in this article is provided for information only and is not intended to be used as medical advice. This article should not be used as a substitute for your own health professional’s advice.  SBS acknowledges the Traditional Custodians of Country and their connections and continuous care for the skies, lands and waterways throughout Australia. ","Sep 17, 2018 ... Marijuana has been decriminalised for medicinal use across the country, ... pain relief methods and quickly zoned in on medical cannabis.",11,922
https://www.sbs.com.au/news/article/uk-boy-with-severe-epilepsy-gets-go-ahead-to-use-medicinal-cannabis/yfg8pvjj2,UK boy with severe epilepsy gets go ahead to use medicinal cannabis,,"UK mum Charlotte Caldwell has been granted leave to use medical cannabis oil for her son Billy. Source: AAP Australia Australia Australia Arts World World COVID-19 Immigration Morning (Mon–Fri) Afternoon (Mon–Fri) Weekend By subscribing, you agree to SBS’s terms of service and privacy policy including receiving email updates from SBS.","Jun 16, 2018 ... The British Home Office is returning a severely epileptic boy's medicinal cannabis oil after confiscating it from his mother at UK customs.",12,50
