url,headline,date,body,snippet,headline_word_count,body_word_count
https://www.sbs.com.au/news/article/comment-its-time-to-legislate-in-favour-of-medicinal-cannabis/lnrewlpor,Comment: It's time to legislate in favour of medicinal cannabis,,"(AAP) Politics World Arts Australia Australia Politics Culture Australia Morning (Mon–Fri) Afternoon (Mon–Fri) Weekend By subscribing, you agree to SBS’s terms of service and privacy policy including receiving email updates from SBS.","Oct 3, 2014 ... Let's hand over the regulation of medicinal cannabis to medical experts so that people who are suffering can get access to an effective ...",10,32
https://www.sbs.com.au/news/article/first-licence-given-for-medicinal-cannabis/bymu9wi2s,First licence given for medicinal cannabis,,"Australia Politics Australia COVID-19 Australia Life Australia Culture Morning (Mon–Fri) Afternoon (Mon–Fri) Weekend By subscribing, you agree to SBS’s terms of service and privacy policy including receiving email updates from SBS.","Mar 8, 2017 ... The first licence to grow and harvest medicinal cannabis in Australia has been granted with Health Minister Greg Hunt promising more ...",6,31
https://www.sbs.com.au/news/insight/article/i-no-longer-had-any-pain-how-a-once-illicit-drug-allowed-cancer-patient-vae-to-live-pain-free/wdo0hizo9,‘I no longer had any pain’: How a once-illicit drug allowed cancer patient Vae to live pain-free.,,"First Person Vae with his two sons. Spotlight to be placed on barriers to medicinal cannabis in Australia Cancer and chemotherapy: 'Being told to stay positive isn't what I wanted to hear' Australia Australia Australia World Life Australia Politics World Morning (Mon–Fri) Afternoon (Mon–Fri) Weekend By subscribing, you agree to SBS’s terms of service and privacy policy including receiving email updates from SBS.","May 11, 2022 ... Spotlight to be placed on barriers to medicinal cannabis in Australia. I gave the doctor a stool sample which, believe it or not, ...",17,63
https://www.sbs.com.au/news/article/qld-cuts-hurdle-for-medicinal-cannabis/cm77gium9,Qld cuts hurdle for medicinal cannabis,,"Queensland has axed state-based approvals for patients to obtain medicinal cannabis. (AAP) World Australia Politics Culture Life Australia Australia Australia Morning (Mon–Fri) Afternoon (Mon–Fri) Weekend By subscribing, you agree to SBS’s terms of service and privacy policy including receiving email updates from SBS.","Apr 4, 2019 ... Sick Queenslanders will find it easier to obtain medicinal cannabis after the government axed state-based approvals.",6,43
https://www.sbs.com.au/news/article/victorias-medical-cannabis-trial-to-treat-children-with-severe-epilepsy-successful/vqgqgu977,Victoria's medical cannabis trial to treat children with severe epilepsy 'successful',,"A supplied image obtained Friday, May 13, 2016 of pictures of the state's medicinal cannabis crop which will be used to treat sick children Source: AAP Legal marijuana goes on sale for the first time in California World Arts Politics Life Culture Australia Australia COVID-19 Morning (Mon–Fri) Afternoon (Mon–Fri) Weekend By subscribing, you agree to SBS’s terms of service and privacy policy including receiving email updates from SBS.","Jan 17, 2018 ... Up to 90 children with severe epilepsy will have early access to medicinal cannabis in Victoria, as the state sets its sights on becoming ...",11,68
https://www.sbs.com.au/news/article/mgc-to-enter-aust-cannabis-market/3s6jd7pfl,MGC to enter Aust cannabis market,,"Australia Australia Welfare Culture Life Australia COVID-19 World Morning (Mon–Fri) Afternoon (Mon–Fri) Weekend By subscribing, you agree to SBS’s terms of service and privacy policy including receiving email updates from SBS.","Apr 4, 2016 ... MGC Pharmaceuticals has its sights set on becoming a leader in Australia's growing medicinal cannabis market.",6,31
https://www.sbs.com.au/news/article/hope-for-medicinal-cannabis-vote-this-year/hv5c5t1z3,Hope for medicinal cannabis vote this year,,"(AAP) Source: Star Tribune Australia Australia Australia Politics Welfare Australia Life COVID-19 Morning (Mon–Fri) Afternoon (Mon–Fri) Weekend By subscribing, you agree to SBS’s terms of service and privacy policy including receiving email updates from SBS.","Aug 12, 2015 ... Federal MPs hope a bill allowing medicinal cannabis will be debated and voted on by the end of the year.",7,35
https://www.sbs.com.au/news/article/baird-confronted-at-cannabis-conference-by-illness-sufferers/tkleoyuz6,Baird confronted at cannabis conference by illness sufferers,,"The NSW government has revealed details of the 19 new councils under its amalgamations plan. (AAP) Source: AAP World Arts Australia COVID-19 Culture Australia Life Australia Morning (Mon–Fri) Afternoon (Mon–Fri) Weekend By subscribing, you agree to SBS’s terms of service and privacy policy including receiving email updates from SBS.","May 14, 2016 ... NSW premier Mike Baird has been confronted by illness sufferers and their carers who have accused him of moving too slowly on medicinal ...",8,49
https://www.sbs.com.au/language/czech/en/podcast-episode/sa-looks-to-economic-benefits-of-medicinal-cannabis-production/lot40zx1u,SA looks to economic benefits of medicinal cannabis production,,Medical cannabis growing in northern Israel Source: AAP,"Feb 2, 2017 ... The South Australian government is supporting the start of a medicinal cannabis industry in the state in the hope of boosting the state's ...",9,8
https://www.sbs.com.au/news/article/key-nursing-union-backs-medicinal-cannabis/kgye5bs6y,Key nursing union backs medicinal cannabis,,"(Getty Images) Politics Life World Australia Australia Australia Arts Australia Morning (Mon–Fri) Afternoon (Mon–Fri) Weekend By subscribing, you agree to SBS’s terms of service and privacy policy including receiving email updates from SBS.","Jun 15, 2014 ... NSW's nursing and midwife union has taken the controversial step of supporting medicinal cannabis use.",6,33
https://www.sbs.com.au/news/article/medical-cannabis-no-magic-pill-expert/5bho5iejb,Medical cannabis no 'magic pill': expert,,"Doctors have been told the evidence on medical cannabis for chronic pain is ""not good enough"". (AAP) Welfare World Australia Australia Life COVID-19 Arts Politics Morning (Mon–Fri) Afternoon (Mon–Fri) Weekend By subscribing, you agree to SBS’s terms of service and privacy policy including receiving email updates from SBS.","May 13, 2017 ... Doctors have been told the evidence on medical cannabis for chronic pain is ""not good enough"" but an addiction expert says it might be a ...",6,48
https://www.sbs.com.au/topics/organization/medicinal-cannabis-australia,Medicinal Cannabis Australia                                  ,,"Medicinal Cannabis Australia SBS acknowledges the Traditional Custodians of Country and their connections and continuous care for the skies, lands and waterways throughout Australia. ","SBS acknowledges the Traditional Custodians of Country and their connections and continuous care for the skies, lands and waterways throughout Australia. 0.",3,24
https://www.sbs.com.au/language/chinese/en/podcast-episode/sa-looks-to-economic-benefits-of-medicinal-cannabis-production/fr6prudag,SA looks to economic benefits of medicinal cannabis production,,"Medical cannabis growing in northern Israel (AAP) By subscribing, you agree to SBS’s terms of service and privacy policy including receiving email updates from SBS.","Feb 2, 2017 ... Medical cannabis growing in northern Israel (AAP) ... Australian government is supporting the start of a medicinal cannabis industry in the ...",9,25
https://www.sbs.com.au/news/article/push-for-medical-cannabis-rolls-on/33zyf0kge,Push for medical cannabis rolls on,,"Momentum is growing for the legalisation of cannabis for medical purposes across Australia. (AAP) World Australia Culture Australia Australia Immigration Life COVID-19 Morning (Mon–Fri) Afternoon (Mon–Fri) Weekend By subscribing, you agree to SBS’s terms of service and privacy policy including receiving email updates from SBS.","Sep 16, 2014 ... The push for medicinal cannabis to be legalised nationwide is gathering steam with NSW and Victoria preparing to conduct clinical trials for ...",6,45
https://www.sbs.com.au/news/article/government-changes-to-make-medicinal-marijuana-access-easier/vx271sxko,Government changes to make medicinal marijuana access easier,,"Government changes to make medicinal marijuana access easier  Life Australia Australia Culture Immigration Arts World COVID-19 Morning (Mon–Fri) Afternoon (Mon–Fri) Weekend By subscribing, you agree to SBS’s terms of service and privacy policy including receiving email updates from SBS.","Feb 22, 2017 ... SBS World News Radio: Patients with chronic illnesses could soon find it much easier to access medicinal cannabis under changes announced by ...",8,39
https://www.sbs.com.au/topics/voices/health/article/2017/04/06/why-will-medical-cannabis-oil-be-legal-victoria-smoking-not,Why will medical cannabis oil be legal in Victoria but smoking not?                                  ,,"There have been huge legal breakthroughs on the issue of medical marijuana in Australia in recent years. Last year, the Victorian state government made moves to legalise its use by people with serious medical issues, including severe epilepsy, cancer, multiple sclerosis and HIV/AIDS. Other states are following in Victoria’s steps to legalise and provide the highly effective pain relief to those who need it most. In Victoria, marijuana is being grown at a secret location and will be produced in eyedropper, oil, capsule, vapour and spray form. But not in a form that would allow it to be smoked. The public perception of someone who uses marijuana oil and a joint smoker could not be more different - cannabis oil has been marketed as a natural and powerful painkiller, often for very sick and vulnerable children. Smoking weed, on the other hand, is considered to be something purely recreational and illegal - ‘stoners’, droopy eyed with the munchies. “Victoria Police (would also not support smoking cannabis being legalised) because the medicinal product could be confused with the illegal product.” It’s not just the public image of smoking weed that’s prevented it from being legalised for medical use; there are genuine reasons for this, says Nick Gadd, from the Victorian Law Reform Commission. “Smoking has adverse health effects and is an unreliable way of dosing; the Cancer Council Victoria among others would not support such a scheme,” he says. Mr Gadd says governments have also run successive health campaigns against smoking tobacco, so it would be contradictory to allow the smoking of medical marijuana. “Victoria Police (would also not support smoking cannabis being legalised) because the medicinal product could be confused with the illegal product,” he says. 




Weed advocate Woody Harrelson quits marijuana due to incorrect use
The 'True Detective' star has broken his silence on the trappings of a cannabis-centric life. 

  Medical cannabis is a strong painkiller for people with severe medical conditions and for many, it is the only effective way of controlling, not only excruciating pain and nausea, but violent spasms and seizures. Despite its effectiveness, patients and their carers have struggled for years to be able to access it legally. Geoff Munro, national policy manager with Alcohol and Drug Foundation, says legalising medical cannabis has been a complex process, in part because of its illegal recreational use and the image that comes with it. Keeping the ban on smoking marijuana will help separate its distinctive uses - recreational and medical - and maintain community support.  ""When medical cannabis is available...in some people’s eyes, it will give it a more positive image,” he says. Keeping that distinction, Mr Munro says, is really important for the integrity of its medical use. ""When medical cannabis is available...in some people’s eyes, it will give it a more positive image.” The way that medical cannabis actually works on the body isn’t entirely understood. However, scientists do know that marijuana is a complex plant that’s made up of more than 60 compounds. Of those, two compounds - THC and CBD - have the biggest impact on users. CBD is the ‘good’ compound, which provides the pain relief and lessons the severity of seizures and spasms, while THC is responsible for the ‘high’ that recreational users seek. Apart from the direct benefit that people suffering from unspeakable pain and seizures will receive from using medical cannabis, there will be other gains of legalising medical cannabis for producers and researchers.  Mr Munro says currently, the ‘illegal’ supply of medical cannabis is almost all synthetic. This is why the Victorian Government has allowed for the cultivation of a crops – which could in turn provide a financial windfall to people with licences to grow pharmaceutical grade cannabis. The other upside, he adds, is that despite the fact that medical cannabis provides so many positive benefits, as scientists have never been able to find out why, because of the law. This will finally allow this medical mystery to be resolved and could pave the way for further treatments. “When medical cannabis is a pharmaceutical product, they have to be suitably tested and the ingredients have the known exactly, and that’s the value we’re going to learn about.”   The documentary, 'The Truth About Medical Marijuana' , exposes audiences to living examples of the benefits of medical marijuana, while exploring the forces that seek to keep the treatments at bay.  The Truth About Medical Marijuana airs on Sunday 9 April at 8:30pm on SBS and is available on SBS On Demand after broadcast.  For SBS VICELAND’s exploration of cannabis in its many forms, check out Weediquette on SBS On Demand. Watch the first episode right here:  




Confessions of a middle-aged weed smoker: Why I'm finally quitting pot
Ian Rose is starting to think his 30-year cannabis habit might not be dope, but dopey. There have been good times, sure, but too many plans and ambitions up in smoke. 



Medical cannabis finally fully legal in Australia's most hipster state, Victoria
After a long battle, Victoria just became the first state to fully legalise medical marijuana.  



Willie Nelson to sell own brand weed
The veteran US singer-songwriter Wille Nelson is to show his ""appreciation"" of pot by launching his own brand. 

 SBS acknowledges the Traditional Custodians of Country and their connections and continuous care for the skies, lands and waterways throughout Australia. ","Apr 7, 2017 ... There have been huge legal breakthroughs on the issue of medical marijuana in Australia in recent years.",12,891
https://www.sbs.com.au/news/article/medicinal-cannabis-to-give-australian-farmers-a-new-industry/00y0cef7q,Medicinal cannabis to give Australian farmers a new industry,,"Medicinal cannabis farm, Dan Eden in Tamworth (SBS) Source: SBS Australia Australia Australia Culture Australia Arts Australia Immigration Morning (Mon–Fri) Afternoon (Mon–Fri) Weekend By subscribing, you agree to SBS’s terms of service and privacy policy including receiving email updates from SBS.","Oct 2, 2016 ... The New South Wales regional city of Tamworth is set to house what could be Australia's first medicinal cannabis farm.",9,41
https://www.sbs.com.au/news/article/medical-cannabis-industry-gets-peak-body/ng9rrpsqe,Medical cannabis industry gets peak body,,"A three-day symposium on medical cannabis will be held in Melbourne from Friday. (AAP) Culture Arts Culture World Australia Immigration Life Politics Morning (Mon–Fri) Afternoon (Mon–Fri) Weekend By subscribing, you agree to SBS’s terms of service and privacy policy including receiving email updates from SBS.","Jun 22, 2017 ... A three-day symposium on medical cannabis will be held in Melbourne from Friday, coinciding with the launch of The Medical Cannabis Council.",6,45
https://www.sbs.com.au/topics/subject/medical-marijuana,Medical marijuana                                  ,,"Medical marijuana SBS acknowledges the Traditional Custodians of Country and their connections and continuous care for the skies, lands and waterways throughout Australia. ",'We were desperate': Family turns to black market for medical cannabis · Why will medical cannabis oil be legal in Victoria but smoking not? · Medicinal marijuana ...,2,23
https://www.sbs.com.au/news/article/gps-to-prescribe-medicinal-cannabis-in-nsw/ixov8m7aq,GPs to prescribe medicinal cannabis in NSW,,"NSW doctors can now write up a script for medicinal cannabis for patients who need it (AAP) Australia Australia Politics Australia Immigration Culture Life Australia Morning (Mon–Fri) Afternoon (Mon–Fri) Weekend By subscribing, you agree to SBS’s terms of service and privacy policy including receiving email updates from SBS.","Aug 1, 2016 ... NSW doctors can now write up a script for medicinal cannabis for patients who need it. Previously you could only access cannabis-based medicines ...",7,48
https://www.sbs.com.au/news/article/medical-cannabis-scheme-on-the-way/qyiwmyla5,Medical cannabis scheme on the way,,"Immigration Life Australia COVID-19 Politics Australia Australia Australia Morning (Mon–Fri) Afternoon (Mon–Fri) Weekend By subscribing, you agree to SBS’s terms of service and privacy policy including receiving email updates from SBS.","Oct 16, 2015 ... Health Minister Sussan Ley says the government plans to amend drugs legislation to allow a licensing scheme for medical cannabis.",6,31
https://www.sbs.com.au/news/article/medical-cannabis-who-has-access/3ga8sxbxd,Medical cannabis: who has access?,,"Politics Politics Culture Australia World Arts Australia Life Morning (Mon–Fri) Afternoon (Mon–Fri) Weekend By subscribing, you agree to SBS’s terms of service and privacy policy including receiving email updates from SBS.","Jun 22, 2017 ... There's a body of evidence around the world that suggests medicinal cannabis, which is now a controlled substance in Australia, ...",5,31
https://www.sbs.com.au/news/article/victorias-plans-for-medical-cannabis-use/tmcuuojd0,Victoria's plans for medical cannabis use,,"Life Australia Politics World Australia Welfare Culture Australia Morning (Mon–Fri) Afternoon (Mon–Fri) Weekend By subscribing, you agree to SBS’s terms of service and privacy policy including receiving email updates from SBS.","Feb 3, 2016 ... Synthetic cannabis will be used in a medical trial hoping to aid sufferers of severe epilepsy in Melbourne.",6,31
https://www.sbs.com.au/language/korean/en/podcast-episode/doctors-concerned-over-senate-bill-lifting-medicinal-cannabis-restrictions/1qr989878,Doctors concerned over Senate bill lifting medicinal cannabis restrictions,,Medicinal marijuana Source: AAP ,"Jun 20, 2017 ... Although a bill lifting medical cannabis restrictions has been passed by the Senate, still doctors are reluctant to prescribe the ...",9,4
https://www.sbs.com.au/news/the-feed/article/medical-cannabis-approvals-increase-by-more-than-a-thousand-percent-in-a-year/egvyq9287,Medical cannabis approvals increase by more than a thousand percent in a year,,"Culture Australia Australia Australia Welfare World Culture Politics Morning (Mon–Fri) Afternoon (Mon–Fri) Weekend By subscribing, you agree to SBS’s terms of service and privacy policy including receiving email updates from SBS.","Apr 11, 2019 ... Medicinal cannabis script numbers on the rise, despite a warning from Australia's peak medical body about lack of evidence.",13,31
https://www.sbs.com.au/news/article/health-ministers-agree-to-cannabis-plan/aclkyerim,Health ministers agree to cannabis plan,,"Health ministers will decide whether to streamline patients access to medicinal cannabis. (AAP) Australia Australia Australia Welfare Life Australia Culture COVID-19 Morning (Mon–Fri) Afternoon (Mon–Fri) Weekend By subscribing, you agree to SBS’s terms of service and privacy policy including receiving email updates from SBS.","Apr 13, 2018 ... Federal Health Minister Greg Hunt has already signed up NSW to the process, which aims to make medicinal cannabis available to patients within ...",6,44
https://www.sbs.com.au/news/article/nsw-leads-aust-on-medical-cannabis-baird/3kpuomfuo,NSW leads Aust on medical cannabis: Baird,,"The lower house of state parliament has passed a bill to legalise medicinal cannabis. (AAP) World Culture COVID-19 Welfare Australia Life Australia Australia Morning (Mon–Fri) Afternoon (Mon–Fri) Weekend By subscribing, you agree to SBS’s terms of service and privacy policy including receiving email updates from SBS.","Oct 18, 2015 ... NSW will work with the federal government to look at how supply and cultivation can be managed for medicinal cannabis trials.",7,46
https://www.sbs.com.au/yourlanguage/sinhalese/en/audiotrack/medicinal-cannabis-applications-few-approvals-so-far-0,"Medicinal-cannabis applications up, but few approvals so far.",,AAP Source: AAP,"Jun 1, 2017 ... Applications for getting medicinal cannabis have risen, but the Greens argue the Federal Government's new access scheme is actually making ...",8,3
https://www.sbs.com.au/news/article/growing-support-for-medical-cannabis/zljq0pst7,Growing support for medical cannabis,,"COVID-19 Australia Australia Australia Culture World Life Politics Morning (Mon–Fri) Afternoon (Mon–Fri) Weekend By subscribing, you agree to SBS’s terms of service and privacy policy including receiving email updates from SBS.","Jun 16, 2014 ... Medicinal cannabis could become legal in NSW within months amid burgeoning support among key MPs and leading medical unions.",5,31
https://www.sbs.com.au/news/the-feed/article/is-medical-marijuana-a-miracle-cure-or-misunderstood/mol1x4kdh,Is medical marijuana a miracle cure or misunderstood?,,"World World Life Australia Arts Australia Politics Australia Morning (Mon–Fri) Afternoon (Mon–Fri) Weekend By subscribing, you agree to SBS’s terms of service and privacy policy including receiving email updates from SBS.","Mar 28, 2019 ... As the world slowly warms to medicinal cannabis, much has been made of its proposed health benefits. But have we over-estimated what pot can ...",8,31
https://www.sbs.com.au/news/article/vic-medical-cannabis-one-step-closer/cqpy674rh,Vic medical cannabis one step closer,,"The lower house of state parliament has passed a bill to legalise medicinal cannabis. (AAP) World Australia Australia Australia Australia Australia Welfare Culture Morning (Mon–Fri) Afternoon (Mon–Fri) Weekend By subscribing, you agree to SBS’s terms of service and privacy policy including receiving email updates from SBS.","Feb 12, 2016 ... The lower house of state parliament has passed a bill to legalise medicinal cannabis. A man cutting leaves of marijuana to produce medicinal ...",6,46
https://www.sbs.com.au/news/article/medical-cannabis-chemo-trial-starts-in-nsw/djm9qqzfw,Medical cannabis chemo trial starts in NSW,,"A world-first clinical trial of medicinal cannabis for chemotherapy patients has begun in NSW. (AAP) Culture World Australia Australia Australia Life Culture World Morning (Mon–Fri) Afternoon (Mon–Fri) Weekend By subscribing, you agree to SBS’s terms of service and privacy policy including receiving email updates from SBS.","Dec 5, 2016 ... The NSW government is hoping to recruit up to 330 people for a world-first trial testing the use of medicinal cannabis to treat chemotherapy ...",7,46
https://www.sbs.com.au/news/article/patients-still-face-hurdles-to-cannabis/h1chhwh50,Patients still face hurdles to cannabis,,"Australia Arts Politics Australia Australia Immigration COVID-19 Australia Morning (Mon–Fri) Afternoon (Mon–Fri) Weekend By subscribing, you agree to SBS’s terms of service and privacy policy including receiving email updates from SBS.","Oct 28, 2016 ... The woman instrumental in the campaign to legalise medicinal cannabis says changes happening next week won't be a silver bullet for ...",6,31
https://www.sbs.com.au/news/article/national-scheme-for-medical-cannabis-ley/5gd65yc38,National scheme for medical cannabis: Ley,,"World Immigration Politics Australia Culture Politics COVID-19 World Morning (Mon–Fri) Afternoon (Mon–Fri) Weekend By subscribing, you agree to SBS’s terms of service and privacy policy including receiving email updates from SBS.","Dec 2, 2015 ... Medicinal cannabis will be cultivated through a national licensing scheme, Health Minister Sussan Ley says.",6,31
https://www.sbs.com.au/news/article/another-cannabis-company-set-to-list/vlj6ecpmb,Another cannabis company set to list,,"Australia Culture Arts Politics World Australia COVID-19 Australia Morning (Mon–Fri) Afternoon (Mon–Fri) Weekend By subscribing, you agree to SBS’s terms of service and privacy policy including receiving email updates from SBS.","Mar 17, 2016 ... Medicinal cannabis firm Auscann Group is set to be taken over by ASX-listed TW Holdings.",6,31
https://www.sbs.com.au/language/punjabi/en/article/govt-to-introduce-medicinal-cannabis-laws/2yf3s7ruj,Govt to introduce medicinal cannabis laws,, Source: AAP,"Feb 10, 2016 ... Laws allowing the controlled cultivation of medicinal cannabis in Australia will be introduced to parliament. A man walks with a marijuana leaf ...",6,2
