url,headline,date,body,snippet,headline_word_count,body_word_count
https://thewest.com.au/business/public-companies/mgc-pharma-granted-medicinal-cannabis-import-licence-c-1153954,MGC Pharma granted medicinal cannabis import licence,"Saturday, 8 April 2023","ASX-listed MGC Pharmaceuticals has secured an all-important import licence from the Australian Office of Drug Control, paving the way for the medicinal cannabis supplier to source products direct from its European production facilities. The approval is expected to result in significant import cost savings for the company and also allow MGC Pharma to expand the range of available products from its Mercury Pharma brand. The granting of the import licence is a milestone achievement for the company, who credits the development with helping advance its strategy towards becoming a vertically integrated bio-pharma company with global distribution capability. According to MGC Pharma, the licence significantly reduces its logistics and handling fees by allowing its Australian operations to directly import schedule 4-prescription only medication and schedule 8-controlled drug products into the country from its Slovenian manufacturing operations. It will now bulk import its medicinal cannabis products for storage, distribution, and sale across Australia through its commercial distribution partners. At a later date MGC intends to expand its importation activities to a wider range of products including those in its Mercury Pharma brand. The company’s medicinal cannabis products are available both in Australia and internationally in New Zealand, the UK, Ireland, and Brazil. A recent company presentation also pointed to new markets potentially opening up in the EU and Israel. The granting of the import licence in Australia is very significant for our Australian operations. With the logistics savings, we are able to become more cost-effective and are also able to expand our product offering to our Australian customers. The company also said it will now look to increase its sales team and access to clinics as it seeks to ramp up its operations on the back of the granting of the import license. In other news, MGC is currently conducting human clinical trials in Israel and India that involve the testing of its natural supplement, “ArtemiC” on patients infected with COVID-19 as a possible treatment for the virus. The company has also been chosen to be part of a global Coronavirus task force set up by the World Health Organisation that will look at various cures and vaccines being developed around the world News of the AODC’s granting of an import licence to MGC Pharma provided a shot in the arm for the company’s share price, which spiked more than 15 per cent on opening trades. NB: This article is for general financial markets news purposes only and is not to be taken as an endorsement of, or advertisement for any individual product, medicine or drug. Is your ASX listed company doing something interesting? Contact: matt.birney@wanews.com.au Sign up for our emails Find out More © West Australian Newspapers Limited 2023","Jul 8, 2020 ... MGC Pharma has secured an import licence, paving the way for the medicinal cannabis supplier to source products direct from its European ...",7,448
https://thewest.com.au/news/wa/mmj-receives-superior-offer-for-canadian-medicinal-cannabis-venture-ng-ya-147554,MMJ receives superior offer for Canadian medicinal cannabis venture,"Saturday, 8 April 2023","UPDATE 1.50pm:  Medicinal cannabis company MMJ Phytotech says it has received and endorsed an unsolicited, superior offer to list two of its subsidiaries in the Toronto Stock Exchange (TSE). MMJ had planned to spin-off its two subsidiaries United Greeneries Holdings and Satipharm in TSE-listed Top Strike Resources. But today it announced it had received an offer from Harvest One Capital Corp, providing total consideration of $C42 million, compared to $US40 million under the Top Strike deal. MMJ would also retain a 70 per cent stake in the new entity compared with 69 per cent under the Top Strike deal. MMJ said Harvest One principals were experienced in the Canadian cannabis sector and provided access to extensive institutional and retail investor networks. MMJ managing director Andreas Gedeon said the Harvest One offer provided the company with the potential to deliver increased value to MMJ’s shareholders in the near-term. “The Harvest One proposal offers a number of compelling advantages, including a materially higher valuation for the United Greeneries and Satipharm assets, which is a significant endorsement of MMJ’s assets and development strategy,” he said. MMJ said it had executive a binding term sheet with Harvest One and would provide further updates on the transaction in the near-term. The board hopes the new entity will be trading on the TSE by the end of the year subject to due diligence and shareholder approval. MMJ's management will be responsible for the operations of the new entity. The deal aims to provide shareholders with exposure to the rapidly growing recreational and medicinal cannabis markets in Canada, which are expected to be worth $C8 billion by 2024. There are already 34 approved medicinal marijuana companies operating in Canada, 10 of which are publicly listed. MMJ said Canada had one of the most highly regulated and favourable operating jurisdictions for medicinal marijuana in the world. The company is also expecting considerable upside from a new regulatory system for recreational cannabis expected to be introduced in the second half of next calendar year. MMJ’s United Greeneries already has cannabis growing facilities in Canada and its Swiss subsidiary Satipharm has a number of key international distribution partnerships for the distribution of cannabinoid-based pharmaceutical, nutraceutical and wellness products. MMJ shares were off half a cent, or 2.22 per cent, to 22 cents at the close. Sign up for our emails Find out More © West Australian Newspapers Limited 2023","Nov 2, 2016 ... Medicinal cannabis company MMJ Phytotech says it has received and endorsed an unsolicited, superior offer to list two of its subsidiaries in ...",9,399
https://thewest.com.au/news/medicine/australias-first-medicinal-cannabis-shipment-arrives-in-perth-ng-b88463866z,Australia’s first medicinal cannabis shipment arrives in Perth,"Saturday, 8 April 2023","The first two commercial shipments of medicinal cannabis products have arrived in Australia under the federal government's new policy to allow controlled importation. The shipments to Melbourne and Perth, both from Canada, are expected to be followed by others throughout the month. Children suffering from epilepsy and patients dealing with side effects caused by cancer treatment were most likely to benefit from the products, Health Minister Greg Hunt said on Wednesday. Sign up for our emails Find out More © West Australian Newspapers Limited 2023","May 2, 2017 ... The first two commercial shipments of medicinal cannabis products have arrived in Australia under the federal government's new policy to ...",8,85
https://thewest.com.au/business/public-companies/mgc-pharma-to-profit-from-proposed-medical-marijuana-law-change-ng-b88396705z,MGC Pharma to profit from proposed medical marijuana law change,"Saturday, 8 April 2023","ASX-listed MGC Pharmaceuticals says its cannabis-derived medicinal products will be fast-tracked into Australia after the federal government announced changes to national medical marijuana laws. In an update to the market on Thursday, MGC said the changes revealed this week by the Turnbull administration would mean patients that are prescribed medicinal cannabis would now be able to import the medication from local outfits, such as MGC, instead of having to source medicinal cannabis from overseas on a case-by-case basis. Under the changes, approved importers will be able to buy medical cannabis medication from overseas for immediate distribution in Australia, until domestic production meets local needs. The policy shift is aimed at making it easier for sufferers of a wide range of ailments to access medicinal cannabis and ease delays currently experienced at present. For Perth-based MGC, the announcement represents a major opportunity given the current ramp up of the company’s European medical marijuana production capabilities based in Slovenia.  The company is also undertaking a clinical trial of its proprietary cannabis formulation for the treating epilepsy in children and this week’s legislation change may provide a fast pathway to market if that trial is successful. Earlier this week the company said that its cannabinoid extraction facility located in Slovenia was on schedule for completion in the second quarter of this year, while its first marijuana crop from the recently scaled-up growing operation was due to be harvested in August. MGC co-founder and managing director Nativ Segev welcomed the new laws and said: ""This is a great step forward by the federal government to ensure that safe, proven medical cannabis products manufactured by companies like MGC Pharmaceuticals are made available to patients in Australia. “ “This measure will reduce the time it takes to import the product into the country, creating a shorter timeline to patient accessibility.” MGC is currently developing its research program into medicinal cannabis alongside its cannabis-based cosmetic and dermatological lines aimed at the growing global market for the previously illicit substance. They have already achieved European and US revenue flows from their cosmetic offering and the company is now moving towards the commercialisation of its dermatological line. Sign up for our emails Find out More © West Australian Newspapers Limited 2023","Feb 23, 2017 ... Perth based ASX listed company to import medical marijuana ... MGC Pharmaceuticals says its cannabis-derived medicinal products will be ...",10,372
https://thewest.com.au/business/health/gina-rineharts-hancock-prospecting-moves-into-medicinal-cannabis-market-with-stake-in-little-green-pharma-ng-b881907703z,Gina Rinehart’s Hancock Prospecting moves into medicinal cannabis market with stake in Little Green Pharma,"Saturday, 8 April 2023","Gina Rinehart’s Hancock Prospecting is extending its reach beyond resources and agribusiness with a $15 million investment in a Perth-based medicinal cannabis producer. Mrs Rinehart is branching into new territory with the cornerstone stake in Little Green Pharma by taking part in a $27.2m capital raising for the listed company to acquire a cannabis cultivation and manufacturing facility in Denmark.  Subscribers with digital access can view this article. Already a subscriber? $9 per week Cancel anytime. Min cost $36. $1 per day Cancel anytime. Min cost $28. Watch and listen to a variety of WA true crime series, video channels and podcasts with commentary on news, politics and current affairs Breaking news, sport, business and more. Get the news you want delivered straight to your inbox so you never miss a headline. Regular chances to win incredible prizes like luxury getaways and sports tickets with our subscriber exclusive competitions Get exclusive discounts on movie tickets, dining and popular attractions. Watch and listen to a variety of WA true crime series, video channels and podcasts with commentary on news, politics and current affairs Breaking news, sport, business and more. Get the news you want delivered straight to your inbox so you never miss a headline. Regular chances to win incredible prizes like luxury getaways and sports tickets with our subscriber exclusive competitions Get exclusive discounts on movie tickets, dining and popular attractions. Find out More © West Australian Newspapers Limited 2023","Jun 21, 2021 ... ... its reach beyond resources and agriculture with a $15 million investment in Perth-based medicinal cannabis producer Little Green Pharma.",15,240
https://thewest.com.au/business/health/australian-medicinal-cannabis-revenue-tipped-to-reach-200-million-in-2021-ng-b881835908z,Australian medicinal cannabis revenue tipped to reach $200 million in 2021,"Saturday, 8 April 2023","Australian medicinal cannabis revenue is tipped to double this year amid growing confidence in the emerging sector. And WA is poised to maintain a significant hold of the market share.  While the State is recognised globally for its optimal growing conditions, local cultivators, manufacturers and researchers have also benefited from limited COVID-19 interference in their operations.  Subscribers with digital access can view this article. Already a subscriber? $9 per week Cancel anytime. Min cost $36. $1 per day Cancel anytime. Min cost $28. Watch and listen to a variety of WA true crime series, video channels and podcasts with commentary on news, politics and current affairs Breaking news, sport, business and more. Get the news you want delivered straight to your inbox so you never miss a headline. Regular chances to win incredible prizes like luxury getaways and sports tickets with our subscriber exclusive competitions Get exclusive discounts on movie tickets, dining and popular attractions. Watch and listen to a variety of WA true crime series, video channels and podcasts with commentary on news, politics and current affairs Breaking news, sport, business and more. Get the news you want delivered straight to your inbox so you never miss a headline. Regular chances to win incredible prizes like luxury getaways and sports tickets with our subscriber exclusive competitions Get exclusive discounts on movie tickets, dining and popular attractions. Find out More © West Australian Newspapers Limited 2023","Apr 2, 2021 ... Australian medicinal cannabis revenue is tipped to double this year amid growing confidence in the emerging sector.",11,236
https://thewest.com.au/lifestyle/health-wellbeing/sa-medicinal-cannabis-producers-oil-to-hit-shelves-from-september-ng-f684810ba64d231eb47b50df0dc7429a,SA medicinal cannabis producer’s oil to hit shelves from September,"Saturday, 8 April 2023","DOCTORS will be able to prescribe the first South Australian-produced medicinal cannabis products from next month. GD Pharma’s oils will hit the market in September after the pharmaceutical manufacturer recently received the green light to import two types of cannabis-derived products. Subscribers with digital access can view this article. Already a subscriber? $9 per week Cancel anytime. Min cost $36. $1 per day Cancel anytime. Min cost $28. Watch and listen to a variety of WA true crime series, video channels and podcasts with commentary on news, politics and current affairs Breaking news, sport, business and more. Get the news you want delivered straight to your inbox so you never miss a headline. Regular chances to win incredible prizes like luxury getaways and sports tickets with our subscriber exclusive competitions Get exclusive discounts on movie tickets, dining and popular attractions. Watch and listen to a variety of WA true crime series, video channels and podcasts with commentary on news, politics and current affairs Breaking news, sport, business and more. Get the news you want delivered straight to your inbox so you never miss a headline. Regular chances to win incredible prizes like luxury getaways and sports tickets with our subscriber exclusive competitions Get exclusive discounts on movie tickets, dining and popular attractions. Find out More © West Australian Newspapers Limited 2023","Aug 12, 2017 ... A LEGAL, South Australian-made medicinal cannabis will be made available to Australian patients within weeks.",10,221
https://thewest.com.au/6247a5bf300879a488d48f834c038770,Health Minister Greg Hunt approves immediate medicinal cannabis trade,"Saturday, 8 April 2023","EXCLUSIVE SICK Australians with some of the worst ailments will no longer wait months for relief or be forced to turn to the black market to access medicinal cannabis with the government green-lighting the legal sale of marijuana products for medical use in Australia.  Subscribers with digital access can view this article. Already a subscriber? $9 per week Cancel anytime. Min cost $36. $1 per day Cancel anytime. Min cost $28. Watch and listen to a variety of WA true crime series, video channels and podcasts with commentary on news, politics and current affairs Breaking news, sport, business and more. Get the news you want delivered straight to your inbox so you never miss a headline. Regular chances to win incredible prizes like luxury getaways and sports tickets with our subscriber exclusive competitions Get exclusive discounts on movie tickets, dining and popular attractions. Watch and listen to a variety of WA true crime series, video channels and podcasts with commentary on news, politics and current affairs Breaking news, sport, business and more. Get the news you want delivered straight to your inbox so you never miss a headline. Regular chances to win incredible prizes like luxury getaways and sports tickets with our subscriber exclusive competitions Get exclusive discounts on movie tickets, dining and popular attractions. Find out More © West Australian Newspapers Limited 2023","Feb 21, 2017 ... MEDICINAL marijuana has been legalised, with the Federal Government approving the trade and import of the drug.",9,224
https://thewest.com.au/news/health/newton-john-champions-medicinal-cannabis-use-after-it-helped-her-cancer-battle-ng-b88588000z,Newton-John champions medicinal cannabis use after it helped her cancer battle,"Saturday, 8 April 2023","Olivia Newton-John will champion the use of medicinal cannabis when she is in Australia this week to raise money for her wellness and research centre. “I will do what I can to encourage it. It’s an important part of treatment, and it should be available,” the singer, who announced a second battle with breast cancer in May, told News Corp Australia. The Australian entertainer said the drug — which is legal in her home state of California — had helped her during her second fight against cancer. “I use medicinal cannabis, which is really important for pain and healing,” she said. “It’s a plant that has been maligned for so long, and has so many abilities to heal.” The government has provided a pathway for the prescription of medical cannabis, but the process has been described as “somewhat complicated”. To date, fewer than 150 patients in Australia have access to medical cannabis, while the industry is still navigating the regulations around cultivation licensing. Newton-John will be in Melbourne this week for a gala dinner for the world-leading Olivia Newton-John Cancer Wellness and Research Centre in Melbourne which she set up following her initial battle 25 years ago. The 68-year-old announced on her Facebook page in May that back pain she had been experiencing turned out to be breast cancer that has metastasised to the sacrum, a bone in her lower back. In addition to natural wellness therapies, Newton-John has undergone a short course of photon radiation therapy. “I decided on my direction of therapies after consultation with my doctors and natural therapists and the medical team at my Olivia Newton-John Cancer Wellness and Research Centre in Melbourne, Australia,” Newton-John wrote on Facebook.  Sign up for our emails Find out More © West Australian Newspapers Limited 2023","Sep 3, 2017 ... Olivia Newton-John will champion the use of medicinal cannabis when she is in Australia this week to raise money for her wellness and ...",11,296
https://thewest.com.au/business/health/emyria-flags-expanding-data-system-beyond-medicinal-cannabis-treatments-to-repurpose-other-drugs--c-6367257,Emyria flags expanding data system beyond medicinal cannabis treatments to repurpose other drugs ,"Saturday, 8 April 2023","Emyria could eventually expand its clinical trial-grade data system — used to accelerate the development of its medicinal cannabis and psychedelic treatments — to assist other companies trialling different drugs. Once solely focused on the collection of patient data to better understand where medicinal cannabis products work best, the Perth-based biotech has pivoted to drug development over the past few years. Subscribers with digital access can view this article. Already a subscriber? $9 per week Cancel anytime. Min cost $36. $1 per day Cancel anytime. Min cost $28. Watch and listen to a variety of WA true crime series, video channels and podcasts with commentary on news, politics and current affairs Breaking news, sport, business and more. Get the news you want delivered straight to your inbox so you never miss a headline. Regular chances to win incredible prizes like luxury getaways and sports tickets with our subscriber exclusive competitions Get exclusive discounts on movie tickets, dining and popular attractions. Watch and listen to a variety of WA true crime series, video channels and podcasts with commentary on news, politics and current affairs Breaking news, sport, business and more. Get the news you want delivered straight to your inbox so you never miss a headline. Regular chances to win incredible prizes like luxury getaways and sports tickets with our subscriber exclusive competitions Get exclusive discounts on movie tickets, dining and popular attractions. Find out More © West Australian Newspapers Limited 2023","Apr 25, 2022 ... Emyria could eventually expand its clinical trial-grade data system — used to accelerate the development of its medicinal cannabis and ...",13,241
https://thewest.com.au/business/public-companies/affinity-secures-maltese-medical-cannabis-licence-ng-b881040778z,Affinity secures Maltese medical cannabis licence,"Saturday, 8 April 2023","Affinity Energy and Health has joined a rather exclusive club of companies that have received approval to establish a medicinal cannabis cultivation and manufacturing facility in Malta. The company will be allotted 2200 square metres of industrial land to construct and operate a fully automatic, controlled environment, hydroponic cultivation, manufacturing and distribution facility. Other companies that were issued the letter of intent by Maltese investment body, Malta Enterprise, include Canada’s Aurora Cannabis, a CAD$7.5bn market cap medical cannabis producer. Malta, a member of the European Union, provides a gateway to the more than 500 million people who live in the 23 member countries that have legalised medical cannabis. Affinity’s planned facility will use its proven “RotoGro” technology used in Canada that allows for up to nine times the surface area for growing compared to traditional growing techniques while allowing for 5.5 harvests per year. This is achieved through the use of stackable, rotating growing beds that are expected to produce 3000 kilograms of cannabis “bud” per annum, once all units are installed. The facility will be built to meet European Union good manufacturing practice standards with an initial 15 growing units. This will be expanded over three years to a total of 175 units. Affinity said the initial build out will be funded through internal resources and the expansions via cash generation. The company will invest an initial €200,000 in a wholly-owned subsidiary incorporated in Malta. A further €3.4m is expected to be invested over 3 years to achieve the planned production level. Separately, Affinity is working with Austrade and Colombia’s ProColombia to submit a licence application for the cultivation, manufacture and sale of medical cannabis in Colombia. This licence is expected to be issued during the first half of 2019. The company’s application for an Australian medical cannabis licence is also currently being processed by the Australian government. Affinity Managing Director Malcolm James said: “The approval of our plans to establish a vertically integrated cannabis operation in Malta is an exciting development which will position Affinity as a globally significant player in the medicinal cannabis sector.” The company said the Maltese approval complements its global medicinal cannabis strategy which includes strategic alliances with key industry bodies and R&D partners. In October, Affinity signed an MoU to be the exclusive supplier of algae and cannabis oil formulations in either discrete or blended forms to fellow Australian company Skin Elements. The two companies will collaborate on the development of a new range of algae and cannabidiol based natural skin care products for supply to key global markets. Affinity also recently executed an MoU with The University of Sydney in August to support its medicinal cannabis research and development activities in Australia. Under this agreement, The University of Sydney will undertake research programs utilising Affinity’s bank of Australian medicinal cannabis cultivars to develop products focused on strategic stress and pain reduction (and management) in commercial livestock and the pet animal sector. With the global cannabis market expected to be worth over USD$55bn by 2024 according to Global Market Insights Research, Affinity’s plans to establish a medical cannabis cultivation and manufacturing facility in Malta provides a doorway into what is looking more and more like a major potential market. Sign up for our emails Find out More © West Australian Newspapers Limited 2023","Dec 4, 2018 ... Affinity Energy and Health has joined a rather exclusive club of companies that have received approval to establish a medicinal cannabis ...",6,550
