url,headline,date,body,snippet,headline_word_count,body_word_count
https://thewest.com.au/lifestyle/health-wellbeing/medicinal-cannabis-users-call-for-government-to-subsidise-imports-ng-92e7cd59c5906d61f3e83fb03f9160d4,Medicinal cannabis users call for government to subsidise imports,"Saturday, 8 April 2023","PATIENTS wanting legal access to medicinal cannabis have been told they will need to pay tens of thousands of dollars a year for the drug, as the state and federal governments continue to fight over who should subsidise it. The Courier-Mail can reveal patients have been quoted up to $34,000 a year, or about $93 a day, from an approved importer – leaving them no choice but to continue sourcing medicinal cannabis through illegal channels. Subscribers with digital access can view this article. Already a subscriber? $9 per week Cancel anytime. Min cost $36. $1 per day Cancel anytime. Min cost $28. Watch and listen to a variety of WA true crime series, video channels and podcasts with commentary on news, politics and current affairs Breaking news, sport, business and more. Get the news you want delivered straight to your inbox so you never miss a headline. Regular chances to win incredible prizes like luxury getaways and sports tickets with our subscriber exclusive competitions Get exclusive discounts on movie tickets, dining and popular attractions. Watch and listen to a variety of WA true crime series, video channels and podcasts with commentary on news, politics and current affairs Breaking news, sport, business and more. Get the news you want delivered straight to your inbox so you never miss a headline. Regular chances to win incredible prizes like luxury getaways and sports tickets with our subscriber exclusive competitions Get exclusive discounts on movie tickets, dining and popular attractions. Find out More © West Australian Newspapers Limited 2023","Mar 22, 2017 ... PATIENTS looking forward to legally accessing medicinal cannabis are now being forced to again consider illegal means.",9,255
https://thewest.com.au/news/wa/push-to-allow-medical-cannabis-for-lily-ng-ya-253399,Push to allow medical cannabis for Lily,"Saturday, 8 April 2023","A Perth mother yesterday confessed she had considered making cannabis oil to help relieve her daughter's pain symptoms but feared repercussions from child welfare authorities. Evidence of the medicinal benefits of cannabis in the form of sprays, tablets or oils is growing worldwide, but the products are illegal in Australia. Today, the Poulter family of five joined a push by WA Labor Leader Mark McGowan for medicinal cannabis to be prescribed in strictly controlled circumstances. BARNETT COULD SUPPORT MEDICINAL MARIJUANA | PUSH FOR MEDICAL CANNABIS ROLLS ON Mother Nicole Poulter said her daughter Lily, 9, had been prescribed a series of opiate drugs for more than two years including Lyrica, Oxynorm and Tramadol to treat the symptoms of two rare disorders. One is Ehlers-Danlos syndrome, which causes Lily’s joints to regularly pop out of place, and the other is complex regional pain syndrome, which overstimulates nerves so the slightest touch is felt as pain. Mrs Poulter said the side effects of opiates on a small body were harsh and the family’s research led them to believe medicinal cannabis would be preferable. “It’s very heart-wrenching, as a parent, seeing your daughter go through so much pain,” she said. “I’ve researched how to make the oil but due to the fact that it is against the law, I can’t do it. We love our kids, we don’t want (Department of Child Protection and Family Support) involved.” Lily said: “If I had a genie I would only have one wish. To take the pain and the syndrome out of my life.” Health Minister Kim Hames has written to federal counterpart Peter Dutton recommending a Commonwealth-led trial of medicinal cannabis. He has said any new drugs on the market need to be approved by the Therapeutic Goods Administration, therefore a federal approach is needed.  Mr McGowan said one letter was not enough and Premier Colin Barnett should be raising the matter with Prime Minister Tony Abbott. “When I came out with this policy back in July (the State Government) accused me of being soft on drugs,” he said. “They seem to have changed their mind a little bit but it’s not good enough.” Sign up for our emails Find out More © West Australian Newspapers Limited 2023","Oct 5, 2014 ... Today, the Poulter family of five joined a push by WA Labor Leader Mark McGowan for medicinal cannabis to be prescribed in strictly controlled ...",7,373
https://thewest.com.au/news/medicine/csiro-looks-to-get-into-medicinal-cannabis-to-take-advantage-of-us44bn-market-ng-b881826109z,CSIRO looks to get into medicinal cannabis to take advantage of US$44bn market,"Saturday, 8 April 2023","Cannabis cough lollies and a variety of products harnessing the medicinal properties of marijuana could soon be produced by Australia’s national science agency as it looks to position the country at the forefront of what could be a US$44 billion global industry by 2024. CSIRO is currently the only independent research institute in Australia able to develop drug manufacturing protocols in the medicinal cannabis space, and the agency has been granted a new licence to partner with local manufacturers to produce therapeutics. CSIRO scientist Professor Peter Duggan told The West Live the new licence would bridge the gap between growing the cannabis plants and turning the plants into medicines. “There’s already more than 20 (medicinal cannabis companies) on the stock exchange, and a number of private companies as well, so there is a huge amount of interest on the Australian scene,” Professor Duggan said. “But one of the issues is a lot of these companies have been focused on growing the plants, getting the right genetics, learning how to dry them, and there hasn’t been a lot of work on the next stage, which is producing actual medicines.” Professor Duggan said smoking a joint wasn’t an acceptable way to absorb medicinal cannabis in Australia, so the simplest vehicle for the delivery of such medicine is putting the cannabis extract in an oil, such as coconut oil. “That’s already been prescribed around Australia, but that’s pretty low technology,” Professor Duggan said. “Capsules or tablets are a slight extension on that, but there are a lot of other formats we’re expecting to be quite efficacious, like lozenges or wafers ... beverages, but there’s a lot of interest in trans-dermal delivery through the skin with creams and patches.” Researchers are exploring the potential for medicinal cannabis to help with conditions such as epilepsy and the nausea and vomiting associated with chemotherapy treatment, multiple sclerosis and chronic pain. Olivia Newton-John, who was diagnosed with stage four cancer in 2017, revealed last year that she and husband John Easterling, a plant medicine specialist, grow their own cannabis in a greenhouse on their property in California.  “I know Australia is a bit behind the rest of the world with cannabis but I’m hoping eventually Australia will realise that cannabis is a medicine and it can help people,” she said at the time. The use of cannabis for medicinal purposes is highly regulated in Australia. However, in December, the Therapeutic Goods Administration approved over-the-counter pharmacy sales of a low-dose form of cannabidiol (commonly abbreviated to “CBD”), one of the key components of cannabis that can help with a range of medical conditions. Professor Duggan said it was possible some people might try to exploit the system to obtain medicinal cannabis products for recreational purposes, as has been observed in America. “There are potential side-effects and potential drug interactions that can lead to unfortunate consequences, so it’s really important people who take these drugs do it through a physician,” he said. However, the CSIRO scientist said he couldn’t see Australia following in the footsteps of America, where CBD can now be found in beer, chocolate and a variety of readily available products. “There’s obviously a push for that in some parts of Australian society, but many medicinal cannabis companies are not keen on that because it complicates the whole thing and makes it difficult for the proper control and care of patients,” Professor Duggan said. Sign up for our emails Find out More © West Australian Newspapers Limited 2023","Mar 19, 2021 ... Cannabis cough lollies and a variety of products harnessing the medicinal properties of marijuana could soon be produced by Australia's ...",13,581
https://thewest.com.au/news/andrew-forrest/from-medicinal-cannabis-to-canadian-nickel-andrew-forrests-biggest-buys-in-2021-c-5033423,"Andrew ‘Twiggy’ Forrest’s biggest buys in 2021: From medicinal cannabis to Canadian nickel, he’s bought it all","Saturday, 8 April 2023","It’s been an impressive buy-up, a spending spree covering everything from medicinal cannabis to Canadian nickel, from Queensland islands to pastoral properties. And it’s barely made a dent in Andrew Forrest’s wallet. As he winged around the world championing green energy, the Fortescue Metals Group founder and chairman’s family business run with wife Nicola was reeling off acquisitions at an accelerating rate for its burgeoning investment portfolio. Subscribers with digital access can view this article. Already a subscriber? $9 per week Cancel anytime. Min cost $36. $1 per day Cancel anytime. Min cost $28. Watch and listen to a variety of WA true crime series, video channels and podcasts with commentary on news, politics and current affairs Breaking news, sport, business and more. Get the news you want delivered straight to your inbox so you never miss a headline. Regular chances to win incredible prizes like luxury getaways and sports tickets with our subscriber exclusive competitions Get exclusive discounts on movie tickets, dining and popular attractions. Watch and listen to a variety of WA true crime series, video channels and podcasts with commentary on news, politics and current affairs Breaking news, sport, business and more. Get the news you want delivered straight to your inbox so you never miss a headline. Regular chances to win incredible prizes like luxury getaways and sports tickets with our subscriber exclusive competitions Get exclusive discounts on movie tickets, dining and popular attractions. Find out More © West Australian Newspapers Limited 2023","Dec 29, 2021 ... It's been an impressive buy-up, covering everything from medicinal cannabis to Canadian nickel, from Queensland islands to pastoral ...",17,247
https://thewest.com.au/news/wa/legalise-cannabis-mp-brian-walker-resigns-from-medicinal-cannabis-company-over-conflict-concern-c-4478273,Legalise Cannabis MP Brian Walker resigns from medicinal cannabis company over conflict concern,"Saturday, 8 April 2023","WA upper house MP Brian Walker has resigned as a “strategic consultant” for an ASX-listed medicinal cannabis company over a “perceived” conflict of interest, just four days after his appointment. The Legalise Cannabis MP had been signed on to provide advice to $170 million business Creso Pharma despite being chair of a WA parliamentary committee into cannabis and hemp use. Subscribers with digital access can view this article. Already a subscriber? $9 per week Cancel anytime. Min cost $36. $1 per day Cancel anytime. Min cost $28. Watch and listen to a variety of WA true crime series, video channels and podcasts with commentary on news, politics and current affairs Breaking news, sport, business and more. Get the news you want delivered straight to your inbox so you never miss a headline. Regular chances to win incredible prizes like luxury getaways and sports tickets with our subscriber exclusive competitions Get exclusive discounts on movie tickets, dining and popular attractions. Watch and listen to a variety of WA true crime series, video channels and podcasts with commentary on news, politics and current affairs Breaking news, sport, business and more. Get the news you want delivered straight to your inbox so you never miss a headline. Regular chances to win incredible prizes like luxury getaways and sports tickets with our subscriber exclusive competitions Get exclusive discounts on movie tickets, dining and popular attractions. Find out More © West Australian Newspapers Limited 2023","Nov 8, 2021 ... WA upper house MP Brian Walker has resigned from a new role at an ASX-listed medicinal cannabis company over potential conflict of interest ...",13,240
https://thewest.com.au/news/drugs-and-alcohol/druggie-stigma-making-west-australians-fearful-to-try-medicinal-cannabis-ng-b881623763z,‘Druggie’ stigma making West Australians fearful to try medicinal cannabis,"Saturday, 8 April 2023"," Fears about being a “druggie” are stopping some West Australians from trying medicinal cannabis, seven months after the State Government introduced changes to improve access to the drug for treatment of everything from chronic pain to anxiety. Matthew Smith, a practice principal at Jupiter Health — one of the biggest GP networks in WA — said there was still a lot of stigma associated with medicinal cannabis products and patients “don’t want to be a druggie”. “Cannabis is seen as an illegal drug and with a lot of stigma associated with it,” he said. Subscribers with digital access can view this article. Already a subscriber? $9 per week Cancel anytime. Min cost $36. $1 per day Cancel anytime. Min cost $28. Watch and listen to a variety of WA true crime series, video channels and podcasts with commentary on news, politics and current affairs Breaking news, sport, business and more. Get the news you want delivered straight to your inbox so you never miss a headline. Regular chances to win incredible prizes like luxury getaways and sports tickets with our subscriber exclusive competitions Get exclusive discounts on movie tickets, dining and popular attractions. Watch and listen to a variety of WA true crime series, video channels and podcasts with commentary on news, politics and current affairs Breaking news, sport, business and more. Get the news you want delivered straight to your inbox so you never miss a headline. Regular chances to win incredible prizes like luxury getaways and sports tickets with our subscriber exclusive competitions Get exclusive discounts on movie tickets, dining and popular attractions. Find out More © West Australian Newspapers Limited 2023","Jul 31, 2020 ... Doctors say stigma is stopping some West Australians from trying medical cannabis, seven months after the State Government introduced ...",10,274
https://thewest.com.au/business/public-companies/mitchell-secures-european-cannabis-license-ng-b88895862z,Mitchell secures European cannabis license,"Saturday, 8 April 2023","Whilst some other ASX listed medical marijuana companies are still trying to fully understand the opportunities around medicinal cannabis, the Brett Mitchell chaired MGC Pharmaceuticals is about to start producing its first cannabis based medicinal products. Just 2.5 years after being back-door listed into Erin Resources by Mitchell, a well connected West Perth corporate finance virtuoso, MGC has already developed its first medicinal cannabis product and built a cutting edge manufacturing facility in Slovenia. This week the company announced it had received a manufacturing license for that facility and it is now putting plans in place to commence production of its heralded medicinal cannabis product known as CannEpil. MGC developed CannEpil to assist epilepsy sufferers to control their epilepsy, particularly in circumstances where traditional drugs are having no impact. The company will now begin full scale manufacturing of its orally-administered CannEpil for final, independent validation before exportation into Australasia and Europe. According to MGC, drug resistant epilepsy accounts for around 30 per cent of the estimated 240,000 people diagnosed with epilepsy each year. Importantly CannEpil is already approved for use in Australia. The newly awarded manufacturing license allows MGC to immediately start production of pharmaceutical grade medical cannabis medicines containing both tetrahydrocannabinol and cannabidiol active pharmaceutical ingredients. The manufacturing license was awarded to MGC after the company successfully applied for “good manufacturing practice” certification, which management says has now propelled its Slovenian facility into the upper echelons of the medicinal cannabis manufacturing industry in Europe. The company is now also able to design and produce additional good manufacturing practice grade medical cannabis medicines that target a range of conditions, many of which are currently on the drawing board at MGC. MGC managing director Roby Zomer said: “We are delighted to have been awarded our formal GMP Certificate and manufacturing licence and to commence production at our cutting edge European Facility, this is one more step in our Seed to Pharma strategy to become a leading BioPharma company with formulated medicines to sell into the global market.” The company’s Slovenian facility could soon be joined by another in Malta with the European island nation passing laws legalising the production of cannabis for medical use in May 2018. MGC only needs to sign formal agreements now with the Malta Medicine Authority to commence construction of another facility in that country. Medical cannabis from the Maltese operation will be used to produce GMP-grade pharmaceutical products at a commercial scale for sale into the EU market, which is expected to be worth $56 billion by 2020. MGC also got its foot in the door of the $265bn global cosmetics market last month when luxury UK retailer Harvey Nichols announced that it would stock its MGC Derma and Derma Plus medicinal cannabis cosmetics lines. Mitchell and his crew originally back-door listed MGC into Erin Resources at 2c a share with a starting market cap of around $14m. By January this year the stock was trading at 12.5c a share, delivering a tidy profit for Mitchell’s original believers. Whilst it is now trading off its highs at around 7c a share, MGC still boasts a market cap of around $76m – nearly 5.5 times the company’s starting market cap when the back-door listing was completed. MGC doesn’t appear to be a fluke either as Mitchell has similar form with telco tech play Sky and Space Global that he helped back-door list into Burleson Energy in May 2016 – also at 2c a share with a starting market cap of around $25m. Sky and Space is now trading at over 8c a share and has a market cap approaching $150m – once again, a 6 bagger for Mitchell’s original cohorts. In the corporate finance world they say you are only ever as good as your last deal and with two 5-6 baggers under his belt in just over 2 years, Mitchell, who is now a partner at Chieftain Securities, is flying high. Sign up for our emails Find out More © West Australian Newspapers Limited 2023","Jul 12, 2018 ... Whilst some other ASX listed medical marijuana companies are still trying to fully understand the opportunities around medicinal cannabis, ...",5,669
https://thewest.com.au/news/qld-to-decide-whether-medicinal-cannabis-users-should-be-able-to-drive-c-8042058,Qld to decide whether medicinal cannabis users should be able to drive,"Saturday, 8 April 2023","Queensland will soon decide whether medicinal cannabis users should be allowed to drive while under the influence as part of a widespread review of the state’s drug-driving rules. The review is in response to the growing number of drug-driving offences and an increase in fatal crashes on Queensland’s roads. Subscribers with digital access can view this article. Already a subscriber? $9 per week Cancel anytime. Min cost $36. $1 per day Cancel anytime. Min cost $28. Watch and listen to a variety of WA true crime series, video channels and podcasts with commentary on news, politics and current affairs Breaking news, sport, business and more. Get the news you want delivered straight to your inbox so you never miss a headline. Regular chances to win incredible prizes like luxury getaways and sports tickets with our subscriber exclusive competitions Get exclusive discounts on movie tickets, dining and popular attractions. Watch and listen to a variety of WA true crime series, video channels and podcasts with commentary on news, politics and current affairs Breaking news, sport, business and more. Get the news you want delivered straight to your inbox so you never miss a headline. Regular chances to win incredible prizes like luxury getaways and sports tickets with our subscriber exclusive competitions Get exclusive discounts on movie tickets, dining and popular attractions. Find out More © West Australian Newspapers Limited 2023","Aug 28, 2022 ... Driving with THC in the system – the psychoactive substance in medicinal cannabis – is illegal in Queensland. Daily News QLD is set to review ...",12,229
https://thewest.com.au/news/fresh-calls-to-change-states-medicinal-cannabis-driving-laws-c-9836651,Fresh calls to change state’s medicinal cannabis driving laws,"Saturday, 8 April 2023","Victoria’s cannabis laws are causing countless chronically ill people to instead take addictive prescription medications, a doctor has warned. It comes amid proposed new laws for the state which would allow to users to drive with the drug detectable in their system. The bill was introduced to the upper house on Wednesday by members of the Legalise Cannabis Party which nabbed two seats at the last election. Among the changes to the Road Safety act would include it no longer being an offence for otherwise unimpaired drivers to have detectable tetrahydrocannabinol (THC) in their blood or oral fluid. TCH is the primary psychoactive substance from cannabis. Dr Karen Hitchcock, who works as a GP specialising in medicinal cannabis, said Victoria’s current laws were pushing patients towards other prescription drugs. “I am referred patients with insomnia, often to assist them to withdraw from addictive drugs with overdose potential – benzodiazepines such as valium and temazepam, opiates, antipsychotics such as quetiapine, and hypnotics,” she said. Dr Hitchcock said a dose of cannabis oil before bed is “often all that is required” to treat symptoms but this can stay in a driver’s system after “the effects of the cannabis have long abated”. “Unfortunately by morning, the patient may still have traces of THC in their saliva, and it may be detected in their blood for weeks,” she said. “Many patients choose to stay on their more dangerous and more addictive medications because of the driving laws. Others take a risk, as the relief and increase in quality of life now that they are sleeping soundly are worth the risk of losing their licence. Dr Hitchcock went on to say the current laws could cause pain-stricken drivers to become a danger on the roads due to a lack of sleep. “Sleep deprivation, we know, grossly impairs driving ability. It is time the laws were changed to reflect the reality that cannabis is a medicine,” she said. “It is time we stopped mistaking innocent citizens for criminals”. Legalise Cannabis Victoria MP David Ettershank, who represents the Western Metropolitan region, said the laws should be focused on impairment, not just THC being present. “People who have been prescribed a medicine and can drive safely should be allowed to drive – this is how we treat every single prescription medicine in Victoria, except medicinal cannabis, and it’s time for that to be corrected,” he said. “Testing for the sheer presence of THC rather than impairment is not right. This failure is based on stigma rather than evidence and the law for cannabis needs to be brought in line with all other prescription medicines.” Currently, Tasmania is the only state which provides a medical defence for driving with the presence of THC in bodily fluids. This is only applicable if the medicinal cannabis is obtained and administered in accordance with state laws. In response to a Bill on the issue in 2019, the Victorian government established the Medicinal Cannabis and Safe Driving Working Group and commissioned research into its potential impact. Originally published as Fresh calls to change state’s medicinal cannabis driving laws Sign up for our emails Find out More © West Australian Newspapers Limited 2023","Feb 21, 2023 ... A doctor has warned a state's current laws are forcing chronically ill people to take addictive prescription medications.",9,529
